date,text,stars
3/29/2013,"I got this for my daughter when we recently purchased the Summer Breeze twin beds with headboard. I already had one mattress (we had a twin over full bunk before these beds) so only needed to buy one. I did my research and this mattress got outstanding reviews so I went for it. I must say that I'm HIGHLY IMPRESSED! It is ridiculously comfortable!! So comfortable that when I took a nap the other day, I went into my daughters room and slept in HER bed instead of my kind sized bed with expensive mattress - no I am NOT kidding! I am planning to get my other daughter this mattress as well, it is THAT comfortable. So glad I found these reviews. And I cannot believe what a great deal it is. The kids LOVED watching it fill up when we removed it fro...",5 out of 5 stars review
12/18/2011,"Read the reviews online and being a regular Walmart customer decided to give it a try. What a great deal! The price for this quality mattress is unbeatable! Quick delivery, bulky box but easily fit into my back seat. Unpacking was the fun part - loved hearing the WHOOSH part as the compression packing was cut open!! It's springy, comfortable and has just the right support for a restful sleep! Using it alone (no box spring) on a platform bed with a comforter from Walmart - NICE!",5 out of 5 stars review
2/11/2012,"I bought this mattress for my 4 year old daughter's new twin bed after reading all the positive reviews. The price is great & I loved the convenience of being able to have it shipped directly to the store for free & being able to transport it home in the trunk of our family sedan. First of all, the way they package these mattresses is genius. You simply unroll it, place it on the frame, cut the plastic and *poof* you've got an 8 inch mattress! Like most of the other reviews have mentioned it's a very firm mattress & it's only padded on one side so it can't be flipped over. My daughter has special needs & used to wake often during the night. Since she's been sleeping on this mattress she's been sleeping soundly through the night so that in i...",5 out of 5 stars review
7/28/2017,I was pleasantly surprised with this mattress. Make sure you give it a full 48 hours before you lay on it. I didn't notice any weird smell. It was super easy to setup and very comfy. I strongly recommend. The photo below is only 10 min after unwrapping it has already inflated double its size. I will give an update in 6 months.,5 out of 5 stars review
9/2/2017,I was very skeptical of this purchase considering how cheap the mattress was. I am now in love with it. Super comfortable. Better than my last one which I spent over 700 on. Absolutely love the purchase. I also bought the bed from Walmart and it's just gorgeous,5 out of 5 stars review
3/28/2012,"Let me take a moment to say how awesome the packaging for this is. We bought a king and it came in a small 2 by 2 by 4 box and was vacuum packed and folded to fit. Opening that and having a king spring out of it was perhaps the highlight of my month (I need to get out more). After sleeping on a hard queen bed for a year this thing was a god send. No too hard and not to soft. If you step on it you will go through the springs down through your box spring, so I wouldn't advise walking on your bed or jumping on it.",5 out of 5 stars review
5/15/2014,"I got this mattress yesterday and today was the first time i slept on it.So comfortable and nice.
Mattress comes in a package .when you unpack it-let the air out and within 30min the mattress was its full size.I would recommend to leave it ""breath""for an hour.then it is all good.
Delivery was prompt-even 3 days than expected.
I hope it will stay that great throught time.",5 out of 5 stars review
6/26/2017,"I ordered 2 full size mattresses for each of my sons rooms. Like everyone says... it comes rolled on a box and vacuum sealed. Once I got the mattresses on the boys bed, and since the boys are away for the summer, I decided to test it out. I'm thinking I need to see if these 6000+ 4/5 star reviews on this mattress is accurate. Saturday night I slept in one of my sons rooms on this new mattress and the next morning I didnt want to get up. This must be the best sleep I've had in over 10 years. This mattress is so comfortable that every position I lay in is perfect. I slept like a baby... I wanted to suck my thumb(lol jk)  Before getting out of bed I ordered myself the same mattress in queen size for my room. I havent returned to my bed and won...",5 out of 5 stars review
9/12/2016,I received this bed in a moderately big package. (I'm 140lbs) Very easy to move by myself into my bedroom. It was easy to unpackage and inflated in a matter of seconds. The instructions stated to wait 48 hours to enjoy the beds full potential but I only waited 8 hours haha yet it was surprisingly super soft. I felt no springs while laying down and I've had it now for almost a week. I love it!!! Definitely a great purchase!! (I order the full sized bed by the way),5 out of 5 stars review
2/26/2017,"I was skeptical but thought I would give this mattress a try since I didn't have the time to physically shop sales only to be told the great deal was not available and I should spend more on another model. This was so easy! The box showed up at my back door and I was able to maneuver it inside and into a room that had a lot of floor space! And, I'm 63 years old with a bad back! I was so happy with it that I bought another one for my guest room. I have been enjoying this mattress for a year and still love going to bed at night.",5 out of 5 stars review
5/20/2016,"I was a tad disappointed when I first opened it because I could feel the coils and thought the top padding wasn't thick enough. Less than 1/2 later I came back and touched the mattress again, this time I couldn't feel the coil and the top padding is fluffed up and feels much better.  The firmness of the mattress is perfect for me. Will be buying a second one for my other bedroom.",5 out of 5 stars review
8/12/2011,"I bought this mattress for my guest room. I put it on the bed frame (from walmart) no box spring needed. It was heavy. I used a hand truck to get it in the house, and the walmart employee to load it in my car....I unloaded it from the box...cut the tape and wam bam...i have a mattress. It's very nice and you'd never know it came in a box. My boyfriend and I slept on it a couple nights ago and its very comfy . I think anyone would be happy with it.",5 out of 5 stars review
3/8/2017,Brought this bed for my son in a twin size and he loves it very soft and comfortable.,5 out of 5 stars review
8/16/2016,Will recommend it to anyone Thanks,5 out of 5 stars review
4/26/2020,They arrived! They are perfect. Waiting on cutom fitted sheets to arrive.,5 out of 5 stars review
1/15/2024,"I would say if you're gonna get this mattress on an upholstered bed frame, make sure you either already have a box spring or get one. With a box spring too, the mattress just becomes so much more comfortable. My dad and I were honestly so shocked when it came rolled up and vacuum sealed. But all we had to do was cut the seal open and let it air out so the mattress could ya know, be more of a mattress lol. But now I'm in love with it. Compared to my old mattress that was so much thicker, this helps my back so so much and it's money well spent. My cats love my new bed as they sleep with me, and everyone that has laid on it loves it as well.",5 out of 5 stars review
1/9/2024,I ordered a full size mattress. It came well packaged. I was able to get it upstairs and onto the bed frame. A quick snip to open the plastic and poof…..there it was! It inflated itself very quickly and I was surprised at how comfy it is! I purchased it for my teenage grandson to sleep on when he visits. He liked it very much. I would recommend!,5 out of 5 stars review
10/21/2022,I am so happy with this purchase.  The quality is so good and full size is perfect. Delivery was so fast and on time.. Hassle free ..,5 out of 5 stars review
12/5/2023,"My mother spent $400 plus on a mattress from Macy's, which then had to be returned for a different one. The second one still didn't work. The main problem was that the mattresses from Macy's had a huge pillow tops which made the bed rounded on the top, super tall and they seemed easy to roll out of! This is a straightforward mattress it's flat on the top, and very comfortable. There are no springs or other things poking out (like I did experience with another less expensive mattress..)
Don't buy this if you want a really tall mattress, but if you want a comfortable, low mattress - which is firm - this one is perfect!",5 out of 5 stars review
11/19/2023,"I am very please with this mattress. This is my first time trying any mattress without a box spring.
The amount of comfort and quality shocked me.
It came quick and fit very well on my queen size frame. I rested very well on this mattress and will purchase another for my other empty bedroom.",5 out of 5 stars review
12/11/2023,"A great bed without spending a lot of money.   Im so glad I purchased this from Walmart as they had the best price compared to other sites. The delivery was so fast that i was not prepared 😅 for it. Once all the plastic wrapping was taken out, the bed inflated to its original size within minutes. I have Zinus mattresses in all three of my bedrooms and absolutely love them.",5 out of 5 stars review
11/10/2023,"Very happy with this purchase. It's really hard to find mattresses at a low cost that aren't memory foam which I feel a lot of people don't find that comfy.. this is definitely not the same quality as a $1000 mattress but for a guest room to a bed that won't get regular nightly use out it, it's pretty great quality. Throw a mattress topper on top for some extra coziness and I think it's will be a big hit with guests",5 out of 5 stars review
11/12/2023,"Was really surprized with the Zinus Quilted 8"" mattress. Needed a mattress fast at a bargain price. I figured at this price if it lasted a year would be happy. My son who has back problems was skeptical when it arrived in a box, but is very happy with it and how comfortable it is. It inflated amazingly quick. He slept on it 24 hours later without as much pain. It appears to be of good quality and he says he sleeps better than on my $800. brand name mattress.  There wasn't any odor to it. Would definitely recommend this mattress.",5 out of 5 stars review
11/17/2023,"I bought this on sale - and it is a fabulous value.  I like a firm mattress - better for my back - and this one is firm.  I did add a foam topper for comfort.  When it arrived it opened up very quickly and I was able to sleep on it the same night.  I did not notice any smell, but I opened it in a well ventilated room anyway.  
I would agree that the edges are soft - I think that is the construction.  There is not metal or wire in the edges like in a traditional mattress.  But I don't sit on the edge of the bed, so I don't care.  It does not affect sleeping on it in anyway.  
As for size - I bought a full and it fills out full sheets very nicely. So I don't see that it is any smaller than a traditional full size mattress. I put it on a frame...",5 out of 5 stars review
11/19/2023,After reading the reviews I decided to take a chance on these mattresses for my new bunk beds and I'm glad I did it fits comfortably on the bed slacks it inflates in a matter of minutes and very comfortable I even received a discounted price  well worth the investment especially if your on a tight budget I bought the twin size mattresses and would purchase another if need. Great job manufacture good quality,5 out of 5 stars review
12/13/2023,"I almost bought this on Amazon, only see the price climb 50% in a week (?). The Bidenflation never ends. The good news is that this mattress is a bargain on Walmart. It shipped fast, and inflated super-quick to its advertised height, and had no smell at all. It does reek of quality though! The mattress is on the firm side, but not too hard. It compares favorably with my much more expensive Simmons Beautyrest mattress. Best online purchase I've made in a while!",5 out of 5 stars review
5/20/2014,I was a little worried about ordering a mattress offline but everything worked out fabulous! I ordered a full size. The bed is firm and comfortable. Shipping was quick not to mention the price for the bed was unbeatable!! :) I totally recommend,5 out of 5 stars review
2/5/2013,"This was amazingly Shocking, Opened the box and BAM! have a full size mattress, Also its super comfy! would def recommend! Shipping came in 2 days with standard",5 out of 5 stars review
8/26/2017,I had this delivered...very easy to handle and put up..really comfortable.  I put it on a little frame i also bought delivered through walmart .... no more cumbersome box springs!!! Love it!! Bought two...one for me and one for my daughter,5 out of 5 stars review
11/17/2022,Perfect just what I needed. Love the price and hybrid idea. Perfect in the guest room,5 out of 5 stars review
12/1/2022,"Fluffed right up, got a great deal on Black Friday and now my son is happier with his larger bed.",5 out of 5 stars review
9/15/2022,"I ordered the full size, and I just love it.",5 out of 5 stars review
6/12/2016,"perfect , good ,beauty and   arrive at  time.",5 out of 5 stars review
9/14/2021,"Love it, feels and looks expensive, no complain!",5 out of 5 stars review
8/21/2021,Great mattress for the cost. Opened right up out of the packaging and is very comfortable.,5 out of 5 stars review
11/7/2022,Came on time! Fabric is fantastic. Definitely worth buying again,5 out of 5 stars review
5/12/2020,Very comfortable and a great back support for my son. He sleep well during the night.,5 out of 5 stars review
1/15/2024,"my teen is picky and thought for sure she wouldn't like this. i couldn't beat the price and tried it. she loves this mattress. not to firm, not too soft, just the right mattress for her. everyone has a different comfort level though.",5 out of 5 stars review
1/9/2024,Very comfy and sturdy bed. I bought the full size for my teenage son. It is very comfy and it is more fluffy than I thought it would be. He says he sleeps much better now.,5 out of 5 stars review
1/2/2024,"I scrolled for hours comparing…this is it super super soft fabric feels amazing.
Bed is firm but soft at the same time, great body support! Highly recommend!",5 out of 5 stars review
1/5/2024,"For an inexpensive mattress, I wasnt expecting much. I was pleasantly surprised when I found this bed more comfortable than the serta and sealy mattresses I've had in the past. It's a bit softer than I'd expected, but thats perfectly fine.",5 out of 5 stars review
1/19/2024,We bought this for our daughters bottom bunk and then later ordered a new mattress in a box for our bed so we had to sleep on the bottom bunk. We were well rested,5 out of 5 stars review
3/19/2017,Bed immediately inflated as soon as I started unwrapping it. I am so pleased with this thing. The regular king size is perfect. I feel like I'm floating when I lay on it. Very supportive and no issues with sheets sliding/popping off like I've had with mattresses in the past. I would post a picture of it but that would require me getting out of it to do so...and well I'm enjoying my day off laying in it right now so just take my word for it that it's great.,5 out of 5 stars review
4/7/2014,"WHEN I PICKED UP THE BOX AT WALMART I THOUGHT WHAT HAVE I DONE?
SO I OPENED THE BOX IT WAS A STURDY BOX AND THE BED WAS WRAPPED TIGHTLY IN A SYNTHETIC COVER. I DID READ THE INSTRUCTIONS AND UNROLLED IT OUT IN THE LIVING ROOM SO I HAD A LOT OF ROOM TO LET IT EXPAND. IT WAS FLAT, REALLY FLAT, SCAREY FLAT.
I WONDERED IF IT WOULD BE AS SOFT AS SOME SPONGY FOAM WITH NO SUPPORT. I CUT THE SEALED BAG AND THE AIR RUSHED IN AND IT EXPLODED INTO A REAL BED. I PUSHED ON IT AND JUST LIKE THEY SAID IT HAD SUPPORT SPRINGS. SO FOR 2 DAYS IT SAT IN THE LIVING ROOM FLOOR STILL IN THE PLASTIC BAG/COVER TO KEEP IT CLEAN AND I THINK IT TOOK A DAY TO COME TO ITS FULLY EXPANDED SELF. NOW WAS THE TEST WITH A PILLOW I LAID DOWN ON IT AND WAS SURPRISED HOW COMFORTA...",5 out of 5 stars review
6/21/2016,"I bought this mattress for a bed in our guest bedroom. The quality, appearance and level of comfort is totally outstanding. The mattress was delivered in a box and was shrink wrapped. It took literally not time at all, once opened, to lay flat.  I am very impressed with this brand and the overall quality. The next time I or anyone I know has a need for a mattress I will definitely recommend this brand.",5 out of 5 stars review
10/31/2016,I ordered a Twin and a Queen size mattress and they are great! The first night I slept on it I was not pleased and noticed I didn't follow the directions in allowing it to expand for 48 hours. The second night I slept on the mattress it was firm and I slept very well.,5 out of 5 stars review
8/8/2016,"My daughter was needing a new mattress really badly but had no money nor a way to haul one, so I decided to give this a try.  SCORE!  She thinks the mattress is totally awesome and it was delivered right to the front door!  Wonderful all the way around!",5 out of 5 stars review
9/4/2023,"I loved the mattress! It's very comfortable and I'd say it's medium in terms of softness: not too soft, but not too firm, just perfect. The mattress comes in a box, which is very convenient, and it was easy to get it back to mattress form. I recommend this purchase! :)",5 out of 5 stars review
3/18/2017,"After reading several positive reviews about this product I decided to purchase it; hoping it was as good as the review claims. I love the king mattress and am totally satisfied with my purchase! I wake up now feeling completely rested! No more back pains. My biggest concern was if the mattress would be firm enough, however, it has exceeded all my expectations! It also comes in great packaging and is easily handled. I recently purchased another, twin size, same brand, and again, very satisfied with the quality. I highly recommend this mattress and company",5 out of 5 stars review
7/26/2016,Pulled it out of the box and thougt I got a futon by mistake. As soon as I unwrapped it and placed it on the frame it started making scary sounds. I popped the plastic around it...BAM! Instant bed. Took about a day to fill out but was worth it. Great matress and worth what I paid for it.,5 out of 5 stars review
2/5/2013,"Im deployed in Afghanistan. I have gone thru 3 BAD military issue mattresses in 2 months. Since WalMart offered free shipping, I compared 5 mattresses. The Slumber 8"" Mattress in a box, won by providing a 5 year warranty. It arrived very quickly! Quickly set up & able to sleep on that night! I have not slept better while here. I am thinking of buying a queen size for Home when I get back!

SSG John
384th MP BN",5 out of 5 stars review
10/27/2016,"I was a little skeptical to buy a mattress compressed into a small box.......but figured ""what to lose""? it shipped fast and free. Took it out and placed on my box spring.......cut the straps and BOING! It puffed up like a banty rooster and filled right up! They did a good design job to get the springs and coils to lay flat I tell you! Jack Russell dog jumped right up and gave it his approval. Wife flopped on it and proclaimed instant love! Best $150 buck I've spent in a long time! Try it, don't like it, Walmart will take it back! $150 well spent!!!!!!",5 out of 5 stars review
2/25/2017,"When the mattress was delivered, I have to admit that I was so upset looking at the unopened box. When I opened the box, I was amazed at how the mattress was able to be literally shrink wrapped into a flat square. it was flattened to about 1.5 inches.  Once I cut the shrink wrap off, the mattress rose to the occasion!  When I placed the mattress on the bed and laid on it... WOW!  This is a great mattress, very comfortable for any kind of sleeper in my opinion.  As well as this mattress sleeps, I would have expected the price to be more.  If you are wondering if you should buy this mattress, yes, go on ahead and buy it.  You will not regret it!",5 out of 5 stars review
5/25/2013,"Skeptical when I received it in a very compact box. Rolled up, and sealed tightly in plastic.
once I broke the vacuum, this was tighter and stiffer than the original mattress it replaced. My daughter loves it. And yes, it has inner springs. Great choice for us for sure.",5 out of 5 stars review
11/23/2013,"I finally broke down and ordered this mattress after several months of debating on it. I had been experiencing lower back pain as well as disruptive sleep on the older mattress I had been using, and usually woke up very stiff with tight muscles and my joints aching in the morning. I knew I needed a new mattress, but was also on a tight budget.

After reading several positive reviews on this product, I decided to go ahead and order a full size mattress. I was pleased from the start! I never expected a mattress ""in a box"" would be so comfortable! The very first night I slept on it, I woke up with NO back pain whatsoever. I knew my prior mattress had been old, but never expected a new mattress would provide me with so much pain relief AND a be...",5 out of 5 stars review
10/22/2023,"This was a great way to get mattresses for a bunk bed.  They arrived quickly, delivered to my door. I opened them beside the bed and then just slid them on.  The covers are very plain, a white fabric with no design.  I always use a mattress protector anyway, so that didn't bother me.    They were thick enough to use without a box spring on the bunk platform.  I found them comfortable to lie on, although they are planned for my grandkids who will love them I'm sure.",5 out of 5 stars review
10/25/2023,"Iordered this mattress for a full size bed. It came quicker than expected. It fits perfectly, no weird smells or squeaky. It feels like it has a pillow top. Its great quality for the price. I highly recommend this mattress and will be purchasing again for guest room.",5 out of 5 stars review
8/13/2014,"Slept on this mattress for a week now, and it was a great buy. My old mattress was 26 years old, so when I got the ad for this mattress in my email from Walmart.com, I decided to check it out. It got to my house in 3 days without any extra shipping charge. GREAT

The mattress came in an easy handling box and uncompressed perfect. There was a video to watch that was very helpful.",5 out of 5 stars review
9/17/2023,WHEN MY MATTRESS CAME  IN WHICH WAS FAST! I WAS A LITTLE BIT NERVOUS UNTIL I OPEN THE BOX( PLEASE DONT CUT YOUR MATTRESS AFTER TAKING IT OUT OF THE BOX OR THE PLASTIC UNFOLD THE PLASTIC!😁) NO I DIDNT CUT MY MATTRESS…..THE MATTRESS IS BIG AND SOFT AND FIRM AT THE SMAE TIME BUT SOFT!! I ENJOY SLEEPING ON IT AND WILL PURCHASE THIS ITEM AGAIN I ENJOY MY REST WELL!!! Zickzack,5 out of 5 stars review
10/3/2023,I was hesitant to get rid of my old bed but it was time. This was my first experience with bed in a box but I'm very pleased. It arrived in 2 days and pluffed up as soon as I cut into the plastic. It's firm but soft because it's a hybrid with foam and springs. I recommended it to several relatives.,5 out of 5 stars review
10/15/2023,"I love this mattress it's so comfortable I brought it twice! It has a pretty, quilted pillow top, it's firm but not too firm, great for kids/young adults or adults who like a semi-firm/softish bed. The designs on the quilted pillow top are pretty, I brought it for my kids; you can't feel the coils!",5 out of 5 stars review
2/10/2014,"Slept on a memory foam mattress for a year and a half, my back has never felt right since. This mattress was delivered in two days, I was amazed that it fit into a box. I haven't slept this great for awhile and I have no more back and neck pains after waking up. I use this with a platform bed and no box spring. Only complaint is that that it doesn't completely fill out my bed as much as the memory foam, and might be a little lower in height, but it's still great nonetheless.",5 out of 5 stars review
8/7/2011,"We purchased this mattress along with the ""Spa Sensations Smart Bed Frame"" because our seven year old set had started causing us back problems in the morning. It stays put on the frame, and is the most comfortable mattress we have found, at any price. It is both supportive and sink-in soft because of the pocket-coil construction with the foam layered on top of it. The sides are ""soft"" -meaning no hard cord digging into your legs if you sit down on the edge, but there is no ""sliding off"" feeling. VERY impressed with this mattress, and would recommend it to anyone looking for a decently priced, comfortable bed.",5 out of 5 stars review
2/2/2012,"I had a rather expensive air chamber mattress but my dogs chewed the hoses which made it a bad fit for us. I have a memory foam topper so bought this mattress to replace the adjustable air chamber mattress. Because of the price, my expectations were pretty low. I really was amazed at the comfort and quality. I would definitely recommend this.",5 out of 5 stars review
5/17/2013,"This is the third Slumber 1 - *"" mattress in a box we have purchased !!! Both our children have the full size and we recently purchased a queen size for our trailer at camp !!!!! would highly recommend to anyone looking for a super comfortable mattress !!!!",5 out of 5 stars review
10/30/2013,"When the box arrived I thought ""how is a full sized mattress in this box""? I just knew it would be flat and useless. It unrolled and returned to it's original size with no bent up corners. The mattress is just firm enough for someone with back issue but still very comfortable. I'd buy it again and suggest it to friends in the market for a reasonably priced, comfortable mattress.",5 out of 5 stars review
