date,text,stars
9/21/2014,"I ordered this for my college bound son. We needed to move him to college and a regular mattress would not have fit in the car. This was perfect and once we let the mattress spring to life we were surprised at how good it actually was. My son is very happy with it and says it is comfortable.

I can't say I would buy this for myself as I have back issues but for a 20 year old, it worked great.",4 out of 5 stars review
12/29/2013,"Got two of these mattresses for a metal day bed and trundle - fit perfectly, and we been using everyday for last two weeks. We went from 1k pillow top to these and we can't complain. They are perfect for the price. We have 230lb relative sleeping on trundle for two weeks straight and he aren't feeling any springs and said it is very comfortable.",4 out of 5 stars review
2/24/2017,"I was really surprised at how comfortable this mattress was, I was shocked at how it came in a box, but after unwrapping this and letting it adjust to it's full size. I'm having the best nights sleep ever. I loved it so much I also ordered a Full size & Twin. One for my son and one for my grandson. I got the Queen. For the price, I am very happy with this. Thank You.",4 out of 5 stars review
5/7/2021,"The matrass is very comfortable and fit my bed perfectly. It didn't take time to expand.  I slept on it the same day it was delivered, had no smell. I need another matrass I sure will buy another one of these.. I am satisfied with my purchase. Glory to JESUS!",4 out of 5 stars review
6/29/2021,This is a very comfortable mattress so far. I've only sleep on it for 4 days so far but so far it's great. Only issue I had was delivery..it was very late. Fed X was bad on delivery. I would recommend that Wal-Mart switch carriers or consumers maybe should order straight from the company and check their carrier. Otherwise to me a five star mattress this far!,4 out of 5 stars review
6/6/2013,"We got this mattress for my toddler because occasionally she needs me or her father to sleep with her. She was in a toddler bed, which meant the floor for us :( We purchased a full-size mattress to put on the floor until she's big enough for a frame and box spring. I also purchased a foam topper and quilted mattress cover to go on this since it was only 8"" tall, and I was worried about the comfort level coming from a box.

It is very comfortable for all of us to sleep on. Hubby and I are both fairly large people, so I don't know how well it would hold up to repeated use by us, but for our 30lb toddler, it's perfect. She started sleeping on it the very first night - no transition period. I was surprised.

The sides do collapse easily as othe...",4 out of 5 stars review
2/15/2014,"This is a decent mattress for the price. I received the mattress fairly quickly. Unpacking it was easy and pretty cool. It came vacuum sealed and once the bag was opened it popped up to actual size. I did let it set for a few hours before I covered with the sheets. It is 8"" and it is a firm mattress. Matter of fact, it is rock hard. I was not expecting it to be as firm as it was so I had to buy an added mattress pad and mattress cover to soften it up. Once I did that the mattress was perfect.",4 out of 5 stars review
12/14/2013,Very good product - but make sure you have a box or base for it - won't work without hard base. Considering box price - total cost of ownership is not really great. but for the matress itself - good enough. Size of packaging is really small and inflation process is fully automated :) and even funny. No issues so far and descent level of comfort for the price listed.,4 out of 5 stars review
2/8/2022,Took a couple days to get it the way it should be. Very firm mattress well worth the price.  Edges are really weak you can easily roll off if you get to close cause they don't have much support there but really for the price it is a good purchase I'm happy with it,4 out of 5 stars review
2/21/2014,"Recently bought it and used for 2 weeks only. It is comfortable so far. Cant say about the life of it.
It was delivered as a rolled blanket completed compressed and vacuumed in a sealed poly bag. Following instructions are mentioned on the box - 1.You must open it within 72 hours of packaging. I recommend you to open it as soon as you get it. 2. For better result you should live it untouched for 48 hours to get it in its original shape and to get it expand to its extent.",4 out of 5 stars review
9/3/2013,"Like many other reviewers I was skeptical at first regarding a mattress that would fit into such a small box...Like those same reviewers I was happily surprised when magic-presto the mattress opened up into a comfortable twin size mattress! Much nicer than the one we had bought my daughter previously. Now, I'm reasonable, I realize you get what you pay for so I was not expecting the same quality as my $1000 Queen, but I'd sleep on it, and get a good night sleep. MOst importantly...my daughter loves it!",4 out of 5 stars review
2/24/2014,"came a week earlier than expected , easy to unpack.
Main reason for purchase was that old mattress had springs that were broken and poking out of the mattress sides. This one is softer than the stated ""firm"", but is quite comfortable. I am sleeping a lot better and my back is not so sore in the mornings.
I would recommend this product ot anyone wishing to replace a worn out mattress.",4 out of 5 stars review
2/24/2013,"After reading all of the excellent reviews, I decided to purchase this mattress for my mother. For the ease of set up and the money, I couldnt really ask for much more. Mom is very happy with her new mattress! However, I didn't realize there were thickness options for this type of mattress. Had I known, I many have chosen a thicker one. This one is good though!",4 out of 5 stars review
1/1/2014,"I, like others who bought this mattress, was very surprised at how good it looks and how comfortable it was for the price. I got it right before my son and his family arrived for Christmas. They slept on it for a week. Said it was really comfortable. A second box spring under it would make it taller and stable if you have the ""slat style"" bed frame (like I did), so, not having a box spring, I had to support each slat with additional pieces of lumber in random places. Its a great buy. Definitely recommend it if you need a starter bed or a mattress for the guestroom.",4 out of 5 stars review
8/7/2014,I purchased 4 of these mattresses for two sets of bunk beds at our vacation rental home. We have only had them for a couple of weeks and they have only been slept on a few times. So far so good. They are not firm but the kids seemed fine on them. I am not sure if you would want these for a 200+ pound adult. They come rolled up in a box and expand out when you take the vacuum seal bag off. So far I am very pleased with these mattresses.,4 out of 5 stars review
7/25/2016,"First of all I was impressed by the way this mattress came in a little box, when I opened the box the mattress was flat and shrunk .......then I told myself ... this is not good ..... but then it  started taking its shape.
The mattress is very comfortable and soft, I would recommend it.",4 out of 5 stars review
4/7/2014,"Purchased to convert a water bed into a regular bed for my grandchildren (ages 13, 2 and a set of twins 1) when they visit. When I laid on it to test it, I stayed there for 30 minutes. It felt better than my bed. I really wanted to switch, but the grandchildren wouldn't hear of it. It is perfect and the price was reasonable.",4 out of 5 stars review
1/27/2017,I received the wrong size first and Walmart quickly remedied and sent the correct one.  It was an interesting process to unpack the new mattress.     I slept great the first night on it...my dogs like it also.  I would give it five star if I had it longer.  It will be interesting to see if it stands the test of time.,4 out of 5 stars review
7/15/2014,"Great idea...I am a single woman without a truck so purchasing and transporting a mattress for my spare room was a challenge. This was an excellent solution as it came in box delivered right to my door and just as the instructions said.....it unrolled and filled out perfectly.

Quite comfortable and sturdy.",4 out of 5 stars review
3/18/2017,I wasn't expecting much for the price. But I'm really satisfied with the purchase. I bought two queens and a full. They are comfortable and fairly firm. Very easy to move.  I bought them with the spa sensations foundations. They work beautifully together. We've been using them for about a month now. They are sure to last.,4 out of 5 stars review
11/1/2012,"This is the second mattress of this type I have purchased, the first one is still giving great comfort but we need a larger bed. I have nothing but good to say about this product. We put a memory foam cover on top at the request of my wife, I prefer it without one. I do not think you will be disappointed with this mattress. Set up is easy and it is very cool to watch it expand.",4 out of 5 stars review
6/25/2013,We were pleasantly surprised that this mattress in a box was soft and firm at the same time. We used this mattress for my 6 year old son's big boy room and he loves it. It would be appropriate for a guest bedroom as well. I would buy another one in the future.,4 out of 5 stars review
7/12/2014,"Don't be surprised at the size of the box this mattress will arrive in! The mattress is literally compressed flat, then jellyrolled into a coil and shipped. The minute I cut open the box, the mattress popped out and started 'growing' to its full height of 8"". Open this box where it has room to grow! Also amazing is the fact that this mattress is firm and surprisingly comfy!!! I found a twin mattress at SAMs for 40 bucks cheaper, but would have had to pay for delivery and schedule it. This one came to my front porch with free shipping! No regrets.",4 out of 5 stars review
2/4/2014,When considering this mattress I actually started with the negative reviews. I also noticed that it had a lot more great reviews. I can say that many of the negative reviews are flat out wrong. I've only had this mattress a week now so time will really tell how well it performs. I really liked the way it came compressed and it popped up like it should. It is actually very firm when laying on it which I personally prefer but can see how it can be too firm for some. I really don't like the fact that it's single sided but knew that before buying. I hope it holds up for a while and I feel that it will serve my needs if it does.,4 out of 5 stars review
11/9/2022,"I liked the mattress, my wife did not (too firm for her).  The problem has been the return.  Evidently Walmart schedules the return with their shipper, EFW.  Then EFW sends an email to schedule the return.  Even if you fill out their online form and reschedule the return, you need to call EFW for an even different schedule because they lack the information that they need for the pickup.  The delivery was fine.  The return has been a nightmare.",4 out of 5 stars review
11/4/2013,"At first sight, I was a little concerned about the mattress, it was a mattress-in-a-box; I was thinking, it wouldn't feel right, it would be a very thin, it wouldn't lay flat, etc. But when I followed the directions....it really was a real mattress and it looks & feels great. If you are in the market for a great mattress at a even better price, this is the one!",4 out of 5 stars review
8/12/2014,"I bought this mattress (full size) for my young son. I had initial reservations on whether it would be truly comfortable based on price as well as it being delivered in a box. To my surprise, the mattress (once expanded to its full size) is comfortable. My son loves it. He's had a restful nights sleep the past several nights since receiving it & has voiced no complaints. So far, I have no complaints either.",4 out of 5 stars review
10/26/2013,"I purchased this and received it at my home right on time as far as delivery goes. True to the manufacturer's words, I took it out of the box and in moments had a full-size bed ready to sleep on.

It looks really nice for the price, and my back and neck has felt so much better since sleeping on it.

I didn't notice any smell like some others have commented on. I would",4 out of 5 stars review
12/16/2013,"This mattress sleeps well under normal circumstances. It is a simple mattress with only one thing in mind and that is for sleep. It keeps its shape and does not lump up in one direction. Very smooth surface all away across. Once asleep you stay asleep, and that to me is the simple purpose of a mattress.",4 out of 5 stars review
3/14/2013,I purchased this because of the reviews I saw lol! It came in a box and unrolled it self like a blow out bed. It's very comfy I sleep like a baby and it's soft. I bought it for my 3 year old n he's happy. Better then buying a used one and good quality. :) FYI: u need a box spring or base!,4 out of 5 stars review
12/9/2013,"This one is pretty good for the price and it comes in a one-person sized package, which was awesome because I was able to move it without my wife's help. Overall, it's good. The only thing I can complain about is that it's a little softer than what I expected.",4 out of 5 stars review
9/2/2013,"I couldn't believe that there was a mattress in the box that was delivered! When I opened it up, there was a queen sized mattress neatly rolled up and vacumn packed in a plastic bag! Upon cutting open the plastic bag, the bed started to unfold and fluff up. It is very comfortable and seems to be holding up well.",4 out of 5 stars review
11/27/2021,"It is a comfortable mattress, and a good deal for the price. However, despite their claims to the contrary, it does transfer motion. 
There is one tip for new purchases: you will need at least two people to set up this mattress. It comes shrink-wrapped inside another bag inside of a box. There is nothing on the box or either bag to tell you how to orient the mattress on the bed. Once you remove the outer bag, it will start inflating, even with the inner bag still on. If you've guessed wrong and need to turn the mattress, it quickly become cumbersome if you're doing it by yourself. Make sure the mattress is correctly positioned before removing the final wrapping.",4 out of 5 stars review
12/1/2013,We bought this for our spare bedroom. We wanted something decently comfortable but not crazy expensive. Once the bed was unwrapped I was happy to feel how comfortable it is. It sits a little lower than a thicker mattress would but it's not too low. I do have my doubts that this bed would last a long time with daily use but it's a fantastic guest bed for the price. I definitely recommend for that purpose.,4 out of 5 stars review
10/24/2014,"My initial reaction when I saw the box was, ""oh no"". I didnt understand how a king size mattress could fit in a 4 foot high box. So I was in a rush to open it to make sure I spent my money on something worthwhile. Once I opened it, the mattress was squeezed down to about 3 inches thick and wrapped in a bundle. I panicked. But once I got the packaging off and air was let into the bag it was covered with, it expanded into a normal king sized mattress. And after laying on it, I was definitely satisfied. I didn't rate it a full 5/5 because of the little heart attack I had when I saw the box.",4 out of 5 stars review
12/13/2013,"Others mentioned in their review that this mattress had an odor upon opening. I did not find that to be so. I bought it for my 4 year old granddaughter, but I tried it out myself, and I think it's pretty comfortable. We'll see how it holds up to the test of time, but for the price, I think it's well worth it.",4 out of 5 stars review
11/25/2013,"I bought the bed for my 4 year old daughter. She loves her new bed. I regret waiting to take it out of the box, I waited 3 days after I received it because the box spring did not come the same day. Unfortunately, the bed did not expand to 8"". I read the instructions when I opened it, and found out you should open immediately or within 48 hours. So if you buy this bed, don't wait. It is still a very comfortable bed and I will buy another if needed for future children!",4 out of 5 stars review
7/6/2014,"I really needed a new mattress and thought about this a lot. I finally ordered it as for me it was easy to have it shipped rather than go to another dealer and also pay a delivery charge. I received it on time. Although, it was heavy, I managed to work with it, with the weight, you may want to have someone help you. Once I completed setting it up, it was like a miracle when I laid on it. It was so comfortable. I was very happy I had made the right choice. I love the warranty. I would recommend this to anyone with no hesitation.",4 out of 5 stars review
9/13/2014,The first night sleeping on mattress felt like coils were poking me in my back. My wife had no issues with her side of mattress. She was tossing and turning throughout the night on old 13yr old mattress. I remembered we did not wait the whole 48 hours maybe 24 hours that they say for mattress to unfold fully. The days after that it felt much better too me. I also had my wife purchase mattress topper 2 inch from Walmart and it feels even better with it on top. I would recommend this but make sure you do what the instructions tell you to do as far as the amount of hours before use.,4 out of 5 stars review
9/2/2022,"The box was a little torn up, but nothing was wrong with the mattress. I purchased a Queen mattress but it's smaller than my queen-sized frame, so I don't think the measurements on the description are right. It's still bigger than a full though.  I've had this mattress for about a week now and it's comfortable but, a little stiff for me though.",4 out of 5 stars review
11/30/2013,"The bed is good for the price. The only real complaint I have is that it is hard to put a sheet on it if you have the bed against the wall. When you pick up on the mattress it fold in half from where it had been previously boxed. It wont hold its shape when you lift up on it, making it difficult to put sheets on. It holds its shape good when lying down though and is very comfortable. Overall a minor complaint for the price and I have no regrets over the purchase.",4 out of 5 stars review
2/22/2013,"The price was great and I got free shipping, even better. The fact that I could put it on bed and let it open up was really cool. So far I am sleeping very well on it and It is comfy, maybe a little too soft for my back but will give it more time to get use to it. I dont think that you can sleep on a mattress for a few nights and rule that it is perfect for you or not. So far I really like it, hope this helps.",4 out of 5 stars review
7/6/2014,"Great Price!!!!-bought 2 based on reviews here for my children12&14 85&115 pounds respectively. Setup is with wooden slats and bunkie board.

SuperFast Delivery- beat expectations on delivery-Ordered Wednesday arrived next day with regular delivery!! (1box torn up but no damage to bed)

Amazing ease of use- carried box up flight of stairs since in box easy to maneuver.

Bed soft and cuddly with some firmness-Children love it!!

Some things that concern me--it's states firm but to me bed is Not Firm( I sleep in a firm mattress). I think like other reviews if you are 250 lb or more this bed will start sinking. I am 190 lbs and I feel that after time it will sink. I would think twice as an adult >200lb buying this for everyday use.

Overall: f...",4 out of 5 stars review
9/7/2014,I have only slept on the mattress 1 day so far and it is very comfortable. It is firm but has some give. It is the perfect size twin for my small room. Very easy to unpack and let it expand fully before using it. I would recommend this mattress to a friend. Very good product so far.,4 out of 5 stars review
7/7/2014,"We bought this mattress for our guest bedroom. Our 20 yr niece is spending the summer with us and has slept on it for a month. She says it's very comfortable although she is using a memory foam topper and only weighs 120 lbs. I laid on it when we received it and it was very comfy. I wouldn't use it as my main mattress but, I think it's good for a guest room or kids room. It was really neat the way it just pops out of packaging and becomes a mattress!",4 out of 5 stars review
3/26/2021,"It's an okay mattress for an online purchase.  It is pretty comfortable, but very flimsy. Unless you plan on using an actual platform bed, you will need a box spring with the mattress, especially if your bed frame has wooden slats to hold the mattress up.",4 out of 5 stars review
5/4/2014,"i bought a queen size- when we first got it, it did have a smell to it. i had read the reviews before buying this and someone else said the same thing. it smelled like a box smell but also a mold smell. so i opened up my window to let it air out and left the door open. everytime i shut my door and re opened it the smell would come back. so i left the door open and didn't sleep on it until i got some febreze and sprayed it down. it took me about a week to sleep on it because i wanted to wait for my allergy bed cover to come and i could put that over the mattress. me and my daughter lay on it and it feels great!! much much better than the air queen bed and the couch thats for sure! yes i would recommend this to a friend. i would say air it ou...",4 out of 5 stars review
6/20/2013,"So i recently moved to a new town and needed a mattress on the cheap that I could use for a couple years and then toss... even the cheapest coil-spring mattresses at the stores are a bit pricier (and I despise the whole haggling back and forth with the salesman - worse than buying a used car). After reading the scores of great reviews I decided to try this thing out. It did arrive timely and in a box! The box was pretty heavy...maybe 70 lbs or so. It fit in the back seat of my camry...thats a plus because then i didnt need to borrow a truck. Directions were easy and it ""inflated"" within 10 minutes. the first night i tossed and turned...but have been fine on it for about 2 weeks now... the mattress is firm and a bit flimsy, but with a box sp...",4 out of 5 stars review
11/30/2013,"I was a little worried this 2 in 1 type mattress would not be comfortable for sleeping but I read the other reviews and most were satisfied with it.
I am a small, light weight person (118 lb) so I am not sure how it would sleep for a larger size person but for me it is ideal. I also wanted something to have as a guest bed for family when they visit, and this has worked out well.
This was purchased primarily for use with a daybed",4 out of 5 stars review
6/28/2021,"I was looking for guest bed mattresses used mainly by grandkids but sometimes adults and I didn't want foam that, in my experience, leaves an imprint after a while. The 8"" spring mattresses arrived within 24 hours, unwrapped easily, and popped into size  correctly. The fabric is soft and appears to be decent quality and the mattresses are well made. They are  quite firm except for along the edges and I would anticipate they might break down after a while if there was frequent sitting on the side of the beds. I already had 1"" foam toppers I used on the previous mattresses and they help soften these new mattresses so I think my guests will be comfy. I am pleased with the purchase, the price, the quality, and the ease of online ordering.",4 out of 5 stars review
3/31/2013,"I read through many reviews before buying this mattress. Most reviews were good, though there are a smaller percentage of bad reviews.
My main concern was getting the mattress and hating it. Would I be able to throw the mattress in a truck, bring to Walmart, and get a refund? After being reassured this was the case I went ahead and bought it.
My old mattress was killing my back. I have slept on this mattress for three weeks and have slept comfortably and my back feels much better. It was set up easily.
My only concern going forward is how long it lasts. If it lasts 5 years I will be happy. If it starts to sink in after a year I will be disappointed. Only time will tell.
I live in Bear, Delaware. There are literally 4 mattress stores within ...",4 out of 5 stars review
1/15/2014,"Indeed. The box really doesn't ruin it. It really does ""inflate"" and regain it's normal shape and isn't all wonky. Of course it's still a mattress for under $200 and it's not some plush pillow top, but it's just fine quality, and especially when coupled with a mattress topper (memory foam for me) it's more than comfortable. Time will tell of course how well the mattress stands up over the long-term, but again- not expecting a lifetime of sleeping on this anyway. Very happy with my purchase.",4 out of 5 stars review
12/19/2013,"We bought these mattresses to move our toddlers into big-kid beds, and it was perfect for a first mattress. We were amazed at how they come packaged - rolled up and compressed in a box and were dubious that they would actually be a substantial mattress, but were pleasantly surprised!

My only complaint to date - the description of the mattress indicates that it works with a platform bed. This means a solid platform base, not bed slats like many other platform beds. We initially bought bed slats and realized very quickly that they wouldn't work as we were setting up the beds. I ended up having to run out and buy twin box springs at the last minute",4 out of 5 stars review
9/1/2014,"This bed would be ok if you were on a tight budget. I would not say that it was firm, but not soft either. Somewhere in the middle. This bed will serve its purpose, but if you want the best mattress around, you should go to a mattress store, and pay much more of course. Recommended for its price and comfortable feeling. Don't think it will hold up for 10 years however.",4 out of 5 stars review
