date,text,stars
1/8/2024,"The mattress is comfortable, easy to maneuver around and the delivery was very quick. When house is rebuilt will buy several more for bedrooms.",4 out of 5 stars review
1/1/2024,"Great mattress for the price. I got this for my son, the last one I bought lasted about 2 1/2 years.",4 out of 5 stars review
8/31/2023,The mattress arrived on time.  It was easy to unravel the plastic around the mattress and it sprang right up.  So far my son has loved it.  He seemed to sleep better also.,4 out of 5 stars review
4/18/2013,"I decided to order this matress due to prior usage . It is a good mattress; I do not have backaches after a night sleeping on it. Overall, it is a very good value . I have reccommend this to several people.",4 out of 5 stars review
9/20/2023,Pretty comfortable for the price. It is more on the firm side and you do not sink into the bed like a memory foam mattress which is nice. Set up was easy and shipping was fast,4 out of 5 stars review
2/2/2017,"easy to handle and move it came rolled up in half  one person can move it .It looked like it was a twin size ,but when it was undone it was what I had ordered a KING SIZE!!!",4 out of 5 stars review
9/10/2023,The box was delivered with a little damage but the mattress so far has been amazing. We waited 24 hours to ensure it was completely inflated. So far my son is enjoying his full size mattress.,4 out of 5 stars review
9/5/2023,"I like it very much.  It did not smell, as I was warned.  I left it alone for 3 days to rise.   I'm a big woman (240 lbs) and this 8"" mattress supports my greatness.  Quite comfortable.",4 out of 5 stars review
8/18/2014,It only expanded to 7 inches but it's very comfortable. The smell doesn't bother me but if you're sensitive to smells it might be a problem. It can handle my weight just fine (250 lbs.).,4 out of 5 stars review
6/22/2023,"Overall this mattress is moderately softer than the Zinus 12” tea tree mattress we have. Since my weight is 160lbs it is functional and comfortable. However, if you are a heavy person this mattress most likely would be to soft. Sitting on the edge of the mattress flattens the mattress and has difficulty supporting my weight. I will use this mattress but I would recommend the natural tea tree mattress which is about $70 more. This mattress has coil spring whereas, the tea tree does not. The mattress fully expanded to 8” in 48 hours. This mattress would be perfect for children.",4 out of 5 stars review
3/19/2023,I purchased this mattress three years ago for my oldest. It's a good mattress and lasts. This is why I purchased it again. It's firm and opens up fully out the box. No flat spots. Only reason I took a star off is because the bed is very bouncy. Other than that a good quality mattress that I got at a good price. True twin size by the way. Fits any standard twin size bed frame.,4 out of 5 stars review
1/26/2024,"The mattress was of good quality and comfort, i will buy it again.",4 out of 5 stars review
2/5/2024,Vacuum seal package is great and overall comfortable just a little hard,4 out of 5 stars review
2/14/2024,Cover was okay but was not as fluffy and soft as I hoped,4 out of 5 stars review
8/8/2016,"I bot the 8"" firm mattress because I only had 2 choices:  soft or firm.  I would have rather had a medium firmness with more cushion as this mattress is a little hard.  The firmness is fine, but there isn't enough padding to make it comfortable for the bones.",4 out of 5 stars review
4/29/2020,"Only have been sleeping on it for about 2 weeks, but so far it's great.  I mean, you get what you pay for, so it's not the *best* mattress I've ever slept on, but with a good eggcrate and  liner, it's miles more comfortable than my 10 year old Serta! Setting it up was super easy, and I have no boxspring, just the metal frame usner the mattress.  No complaints!",4 out of 5 stars review
1/20/2013,"I was very afraid to spend such a cheap amount for a mattress but I read all the reviews and found everybody liked it so I took a chance to buy it because I desperately needed a new mattress because I was waking up feeling miserable with aches and pains everywhere. Well to my surprise the first morning I woke up I was like "" wow I sure feel different ."" It is worth the money!",4 out of 5 stars review
7/24/2014,"Just picked up the bed from my store on 7/22/14. The Site to Store option is always the best because I'm not always home to ship to house. The bed was presented to me in a box, which was a little concerning. When I got home and cut open the box, you can see that the bed basically looks like it has been vacuum sealed into a really larger plastic bag. Once you break the plastic, you immediately here the bed start to suck in air, lol. It started to inflate into a full size twin bed instantly. Within 5 mins of removing its packaging, we had it on the floor and my boyfriend who is 6' and 240lbs, laid on it and complemented on how comfortable it was. He continued to lay on it for the next 3hrs while watching a movie to ensure it was going to be g...",4 out of 5 stars review
5/19/2013,"I was truly amaze to watch this mattress inflate let a blowup bed ,but it was full size mattress that was very comfortable but very firm. In next 48 hours the mattress was up to it's full size and even more comfortable. I was even more impress on how it was pack for delivery the box fit in the rear of car.",4 out of 5 stars review
7/14/2016,"The mattress came one day later than expected, but other than that everything was as stated. It came in a box rolled up.  I unwrapped it as instructed and it took about 24 hours for it to reach 8"".  It was a little softer than I would like, but my 4 year old is sleeping on it and it seems to be fine for him.",4 out of 5 stars review
11/4/2016,"bought for a teenager,twin size used on a platform. It is a bit firm but not like a rock. it has enough ""give"" to be comfy  but you won't sink to the bottom like a cloud. haven't had any complaints  and he seems well rested. We also have a queen size on a platform have had for 3 years  with two people sleeping on it one over 200lbs one just under and it is holding up well. we have a thin topper on that one (not memory foam) I expect at around the 5 year mark we may get another to replace the queen. cost and value are nice.",4 out of 5 stars review
6/20/2016,"I only have this item in use for two days. So far the mattress feel comfortable and provides a respectable quality for the money.  This is not a top of the line mattress for a daily use, but it will serve us well for our guest room.
Will provide another update in a few months to see how the mattress performs after multiple uses.",4 out of 5 stars review
5/25/2013,"Much better than I expected for the price, a real value. I bought this in a queen size for my guest bedroom and tried it last night. It's very comfortable. I don't know how it will hold up, but it will not be used that often. Surprising that it was delivered rolled up, and expanded to full size after a few hours.",4 out of 5 stars review
11/7/2023,"For the price it was definitely a good buy! Although I think if I order again, I will get a thicker mattress.",4 out of 5 stars review
11/10/2023,"For the price it's not bad . A spring mattress that's not stiff hard ,  it's great for a starter mattress if you're just trying to get things going .",4 out of 5 stars review
1/5/2024,Very comfortable and a great bed for our truck camper.,4 out of 5 stars review
1/4/2024,"bed is great, not too soft and feels pretty sturdy.",4 out of 5 stars review
1/2/2024,"great price, fast shipping,  comfortable to lay and sleep",4 out of 5 stars review
1/7/2024,"easy shipping /delivery,  good support for 180lb guy and company....",4 out of 5 stars review
1/16/2024,Seems to breakdown when used daily. Might want to spend another $100 unless used sparingly,4 out of 5 stars review
12/26/2023,Comfortable for my kids bunk beds,4 out of 5 stars review
1/10/2024,it's a little too firm for me but I will solve with a pillow topper.,4 out of 5 stars review
10/3/2023,"I purchased 2 of these.  One for my camper and the other for my daughter, very comfortable and great price.",4 out of 5 stars review
10/23/2023,Nice and firm. Was able to sleep without back pain. Low profile. You can kind of feel the springs but could always just add a topper.,4 out of 5 stars review
8/24/2023,it came as stated. inflated to be a firm mattress. i havent had it long enough to know if its durable or will last,4 out of 5 stars review
3/27/2023,I like this mattress the look of it is really nice and I love the firmness I wish it was a little thicker but the price is what I wanted so I like it. I've purchased this mattress twice now for two different beds so yes  that means I do like it,4 out of 5 stars review
11/25/2023,It will get the job done. It is a little firmer than I would like but overall ok.,4 out of 5 stars review
12/2/2023,"Mattress a lttle to hard, but everything else is great",4 out of 5 stars review
11/25/2023,this mattress was perfect for our guest bedroom,4 out of 5 stars review
12/22/2023,Good bed add a pillow top and enjoy,4 out of 5 stars review
11/4/2023,"The mattress firm and heavy. It's great, I got it on sale.",4 out of 5 stars review
11/18/2023,got this mattress for my 13 year old. he has no complaints.,4 out of 5 stars review
12/20/2023,my children loved em said they are very comfortable I purchased a queen and queen,4 out of 5 stars review
12/24/2023,The height and firmness are nice,4 out of 5 stars review
11/8/2023,The mattress is comfortable. Just remember 8 inches is a lot smaller than you think.,4 out of 5 stars review
9/25/2016,"very easy set up.  came up to size very quickly.  wish the sides were just a bit stronger,  you notice it when you sit on the side of the bed to put your socks on.",4 out of 5 stars review
2/22/2017,"My mattress in a box was delivered within two business days, no shipping charge. It was easy to remove from the packaging and was ready to use that night. Much more convenient and less expensive than a mattress store.",4 out of 5 stars review
7/31/2019,"I have been sleeping on this mattress for about a week now and I have to say that it is comfortable! There weren't any weird smells lingering and it inflated to the full 8"" all the way across the mattress. As a 5'10 women (roughly 150lbs) I was able to get it out if the box, out of the plastic, and onto my bed frame within 15 minutes.

Cons: 
- There were not any instructions provided on how to decompress the mattress or how long to let it sit before using 
- It has a long yellow stain in the corner of the it",4 out of 5 stars review
11/9/2019,"The idea of a getting a rolled-up compressed spring mattress delivered in a box made me skeptical, but I took a chance and I'm surprisingly pleased thus far.  (I don't know how well the mattress will hold up over time, but so far, so good.)  There is a warning that the mattress is ""under a lot of pressure lately"" and to be cautious when releasing it, but the mattress made a noiseless smooth transition within a matter of seconds.  I was actually amazed over what I saw transpire as well as what I did not see but obviously had occurred.  The mattress appeared to be fully inflated and ready to use, but I followed the instructions and let it set(tle) for 48 hours on the floor.  I'd say that the mattress is reasonably priced, of at least satisfac...",4 out of 5 stars review
12/28/2012,"I went from a 10 year old $900 king size mattress to this bed-in-a-box. It was pretty much what I expected. It's comfy, but thin and the edges drop. When you sit at the end or side of the bed, you kind of slide down because there's little support around the outside of the mattress. It was easy to install and would be good for a guest bed, but I'm sure I'll be purchasing a ""real"" supportive mattress within the year.",4 out of 5 stars review
12/29/2016,"So, my 4 & 5 year olds were ready for regular beds. These were the Best plan for my family for the money! We already had frames, but new mattresses locally were just out of our reach financially. Other than a minor shipping glitch which, may have been my own fault, everything else went perfectly! They set up in minutes, I let them ""settle for 72 hours, just to be sure, & VIOLA! New beds for my kids. They are both VERY HAPPY, which makes me happy! THANKS WALMART!",4 out of 5 stars review
9/12/2013,"I bought this to go with a platform bed, and because shipping was a lot less hassle that wrestling a mattress up the freight elevator to my apartment and it arrived when expected.

When I opened the box the first thing I thought was: this is a mistake. How are you going to fold this thing back up and lug it to the store? Even though it expanded as promised, I was still skeptical.

I let it breathe for the recommended time. When I did sleep on it, I was amazed. I kept waiting for it to collapse but no, I slept like a baby. I don't know who this mattress would not work for, but it works great for me. I'd buy another without thinking twice.",4 out of 5 stars review
4/2/2013,I purchased this mattress for my sons first big boy bed. It does come in a box. I did have it delivered and they left it on my step. I had no problems moving it myself (single mom). The mattress does expand a great deal after you open it up and gets firmer within one day. I would not get this for a grown person or very heavy child. It is a great starter mattress for a little one. My son loves it and sleeps very well.,4 out of 5 stars review
10/31/2016,Received it quickly in a box as advertised. Opened easily and took on the shape and size as per the description. It fit perfectly into the twin platform bed I purchased and it appears to be very comfortable. I guess time will tell about durability but appears sturdy enough for an adult sleeper. This one is in my guest room so will be used few weeks at a time on and off. Very pleased with it so far. Didn't give it 5 stars since not sure about the wear.,4 out of 5 stars review
1/29/2013,"I bought this mattress for my 4 yr olds new captains bed. It's so comfy. My husband and daughter have taken turns sleeping on it and they both want it. My husband said that he woke up without back pain in a long time after sleeping one night on this bed. I will be purchasing two more for my daughters.

I didn't give 5 stars because we've had it only for a week so I'm not sure how it will be three months down the line.

Shipping was super fast....I received it maybe three days after I ordered it. It comes rolled up in a box....vacuum sealed. Once you open the plastic up just a big, the air rushes in and mattress expands in seconds. So far we love it.",4 out of 5 stars review
1/31/2013,I have multiple orthopaedic problems and arthritis as well as fibromyalgia. This mattress is wonderful. I dont wake up feeling like I' ve been in a cage fight each morning. I've only had it for a short time but so far I've already got my moneys worth in sleep. The one con is; it is difficult to lift unless you have help.,4 out of 5 stars review
10/18/2016,"Mattress arrived in comparatively small box .  Packaging opened fairly easily and
mattress expanded relatively quickly to 8.5 inches.  It is a nice looking mattress
and fairly comfortable.  It is not as firm as I expected and you do tend to sink into it a little more than I like.   The other thing that I noted is in spite of the claims for having firm edge support, in reality the edges have very little support.  I definitely prefer having firmer edges on a mattress.  Overall, I find the mattress to be fairly comfortable but will know more after a few months of sleeping on it.",4 out of 5 stars review
3/30/2013,"Too good to be true? It's not! I was skeptical that a mattress-in-a-box would be a poor choice, but I was surprised when I slept on it. It's firm, but not too hard. It also is much more comfortable than I would have imagined it to be.

It arrives in a box that can be carried/handled by one person. It is a bit heavy and awkward when you unwrap it, but it positions easily. Once the sheets were on it, it was ready to go. It took about two days to fully ""puff up"", but it was comfortable right out of the box. The edges are a bit soft, so don't sleep on the edge.

I'm pleasantly surprised how comfortable this mattress is (I spent most of the day in bed simply relaxing).",4 out of 5 stars review
5/5/2014,"Overall, a very good value. If using/buying for permanent/primary mattress, I prob wouldn't recommend if you were heavier set, say maybe 250lbs or more. The springs are not as heavy gauge so it could affect the comfort levels, and you can also feel them on the edges. I'm 6' 2"" and it feels really good to me. Def not a high end mattress, but a great value for spare/guest bedroom(for non-heavy guests imo lols) which is what we bought this for. Easy ordering and delivery. Weighs about 60lbs or so. Easy unpacking, but let it ""air out"" for a day or so for it to fully expand before sleeping on it.",4 out of 5 stars review
4/15/2014,I bought this matress for my son. He loves it and says it is so nice to sleep on. He is happy that he does not feel the springs any more like he did in his old bed. Mind you he is 8 years old but has not slept well through the nights until getting him this new mattress. So far very pleased with this and would recommed it.,4 out of 5 stars review
3/4/2014,"The box was huge but not so far out in weight that I couldn't have lifted it myself. But for safety, a friend helped lift it onto the box spring. From there it was simple to remove the box and plastic covers. My friend had to leave but moving it around on the box spring was easy. Very light compared to an actual clothe mattress. It expanded in moments and I laid on it to nap - without blankets or sheets it was superb. Later when time to go to bed for the night with sheets and blankets - I slept like a baby - or so they say that is what it was like. I have been sleeping on everything but a bed for about a year and my body fell in love with this mattress. I sleep deeply and comfortably for a few hours at a time and wake up feeling wonderful. ...",4 out of 5 stars review
3/8/2013,"mattress arrived rolled up in a small box, shrink wrapped and our first reaction was we really don't want this. But when the plastic was punctured, air immediiately filled the mattress up. It is surprisingly sturdy and very, very comfy. Used for small kids on a bunk bed and don't expect it to last for many years, but right now its perfect. pretty cool technology.",4 out of 5 stars review
2/24/2017,"The product picture makes it look almost ""pillow top"" like, but it is not, at all.  Very very flat mattress.  Pretty firm.  Would not recommend for an adult regular nights sleep.  I use for my 10 yr old daughter regularly.   Can be used for a guest mattress or child's mattress.",4 out of 5 stars review
2/21/2014,"The mattress comes in a box that 2 people can carry. Does exactly like video. Open the box, cut the plastic off and wala you have a perfect mattress. I didnt have anyone sleep on it for 48 hours as per instructions.

The mattress is firm. I would like the sides a little more firmer because thats the way you get out and that usually goes first on a mattress.

The mattress is great for anyone who lives in a dorm, apartment or who doesnt want to pay the extra charge to have a mattress delivered. This mattress is just as good as any bed store place.",4 out of 5 stars review
6/5/2016,"This is a great mattress for the price. 
If you want a firm mattress this isn't for you. I loved it but my husband has back issues and has to sleep on a firm mattress , so he tried it one night and had to go back to his firm mattress.
If you don't have back issues, then you will love it!",4 out of 5 stars review
10/12/2016,"Nice firm mattress. As with anything, your body has to adjust to something new, especially something your body rests on for 7-8 hrs. My first two nights had my body a little whacked out, back was achy. I've had it a week now and my last several nights I have been sleeping like a baby! Decent mattress for the $$",4 out of 5 stars review
3/15/2013,"Was I surprised when a relatively small box arrived. I was expecting this good sized cardboard box... I did order a full size mattress. But it had been compressed, rolled, and vacuum sealed, then wrapped again and taped. As soon as I punctured the sealed plastic wrapper... the mattress unfolded into a regular sized full size mattress. Very cool! Good mattress... 8"" thick and very comfortable. Good deal if you ask me!",4 out of 5 stars review
8/12/2016,"I was looking for something cheap but decent to replace mine in a pinch, and this is surprisingly comfortable and durable for the price. I would highly recommend this for a guest room or even for a first ""big boy/girl"" bed. It set-up quickly, and was ready to nap in fifteen minutes after it arrived!",4 out of 5 stars review
5/1/2014,"I like the mattress overall, especially for the price but I can feel some springs poking here and there. I just have to adjust myself and its fine. If you have the money, spend it on a better mattress. I myself am on a very tight budget so this will do.",4 out of 5 stars review
3/18/2014,"Great mattress! I was surprised how quickly the order came to our home as well as the small box size for a large mattress. Once opened, the mattress began filling up to become a full size mattress in no time. The mattress is extremely comfortable - it is moderately firm (not too soft and not too firm - just perfect). This is a great mattress for the price!",4 out of 5 stars review
9/7/2013,"I ordered the queen size and it came in a box that was easy to fit in my focus back seat. Unboxing was as simple as most say unfold the mattress then remove plastic, it fluffs up in a few mins and was almost full size within a hr. The mattress is not as soft as some claim I would put it more on the firm side. I've had no problems sleeping on it and zero back pains.",4 out of 5 stars review
3/5/2013,I recently bought this mattress for my 3 year old daughter to sleep on. I went from having her sleep with me for a few weeks to having my bed back again! I found out her old bed was really uncomfortable for her to sleep on. Assembly was very easy and took less than a half hour for me to actually get it set up in her room. I used the Smart base foundation that made it to where you didn't need a box spring for the mattress. Overall if you are thinking about upgrading your bed for your kids this will suit just perfectly for them!,4 out of 5 stars review
3/31/2014,We have been using this for less than a week now..It came fast..surprisingly no smell... (I am sensitive to smells) opened quickly and looked quite ready for a good nights sleep the same day..although we waited for suggested 48 hours before we started using it.,4 out of 5 stars review
12/10/2016,I thought it was going to be a cheap springy bed. But its thick and super comfortable. Several people that have stayed over to use the bed ask me where I got it since its so comfortable. When i say it came from Walmart and in a box they're fully amazed. Awesome Deal!,4 out of 5 stars review
7/25/2016,This mattress was exactly as shown on the website.  I followed directions and the mattress inflated to full 8 inches in 24 hours.  It's very comfortable and has improved my sleep.  I gave 4 stars because I don't know how it will hold up over time even though it has a 10 year warranty.    So far I am satisfied with this product.  It is well worth the price.,4 out of 5 stars review
10/20/2016,"I have had this bed for a couple of weeks now. I will update if anything goes wrong.
But so far I've been very happy within my purchase.
I had it delivered to the store and it arrived four days early!!!
I took it home and opened it and it inflated almost instantly to the full size!!!!
It is a solid mattress and a little on the firm side (which is what I wanted).
I have slept on this mattress every night for two weeks and i am very happy. So far I cannot feel any springs or coils. It is a little on the firm side but definitely supports you. 
I am 5'4 and about 200lbs. I have had problems with mattresses sinking in the middle due to my weight. This holds up and I don't wake it feeling like I've sunk in a hole.
Overall, I am very happy. I have...",4 out of 5 stars review
7/12/2016,"The shipping was quick and the box came in good shape. The mattress expanded after taking it out. It is quite a comfortable mattress according to my 8 yr old grand daughter. Time will tell how well it hold up but it seems like a great bargain. You will need support under the mattress, either a bunkie board, platform or plywood.",4 out of 5 stars review
6/16/2016,I was thrown off when the queen sized mattress arrived in this small box.  Once I opened it and it inflated it was awesome!!  I bought for my son who is going to college and he is very happy with the mattress and he says that it is very comfortable.  Don't let the box that it arrives in throw you off.  It takes 2 days for it to inflate completely and once it does it is a regular mattress.,4 out of 5 stars review
11/12/2013,"This mattress arrived rather quickly. When I saw the big box I was a bit skeptical. Upon opening the box I thought it would never work. But then I removed it from the box and cut the tape that was binding it, and Voila!! I had a king size mattress!! And it is pretty darn comfortable! I am not having problems adjusting to it and sleep well on it. Make sure when you open it that you are near your bed frame, because this thing opens up fast! The price was awesome. No complaints from me!",4 out of 5 stars review
