date,text,stars
11/6/2023,"Truly like our new full size bed for guests. But , the middle metal bar that helps hold up the bed frame sticks out a little more than I like!! Needs placed further inside of bed frame!  Also purchased mattress firm, and pillow topper, very comfy:)🥰👍🏼👍🏼",4 out of 5 stars review
1/4/2024,"honestly much better than i expected.  i thought the bed would be rough, but it's
 soft. the pictures here were taken right after i got the bed out of the box.",4 out of 5 stars review
7/14/2014,"I purchased this mattress in August of 2011 and paid $209 for the queen size plus $70 shipping as free shipping was not available on the item at the time (hence my 4/5 rating on value, seeing as it would be around $100 cheaper now then when I originally purchased the item).

The mattress is one of the most comfortable mattresses I have had and I received major compliments on the cloud like feel. I was a bit apprehensive to order a mattress-in-a-box and was definitely hard to explain it to friends and family that the bed literally inflated upon arrival.

In or around December of 2013 I too began to experience the sinking in the mattress. After months of uncomfortable rest I was tempted to buy a new mattress. I was going to buy the same exact...",4 out of 5 stars review
4/17/2020,"The mattress is excellent for the price. It was easy to setup and the quality looks good. Note that the mattress is extra firm, so if you lay flat all night, you will ""feel"" it in the morning, but nothing too bad, especially considering the price. Mattress prices are ridiculous so if you're looking for something of good quality and inexpensive, you won't be disappointed.

I've had to deduct the 1 star because Walmart's packaging was disastrous. I was surprised to see the mattress wasn't damaged. The packaging was torn in multiple places as if rats as eaten through it.",4 out of 5 stars review
3/23/2021,I bought this because one it was affordable. And 2 its just a temp for now. My son loves it. And im hoping my twins do as well. It cane in a box and soon as i unwrapped it. It open real quick. With plastic on to protect it. Very happy for my purchase. Why i gave it 4 stars? Only slight issue is it had a tiny space between the mattees and the bed. Which isnt a big deal but I would rather it fit perfectly,4 out of 5 stars review
6/20/2021,"I give This mattress four ⭐ because I will buy it again for a child. The side holds up well to adult weight. But laying on it I can hear the springs popping, like it's busting out of the wrappings. The quilted material is a stain magnet. I spill a little tea on the mattress, thaugh I had wipe it clean , tea stain came back, bigger.",4 out of 5 stars review
1/19/2014,"This mattress is easy to carry if you need to pick it up at the store. It comes in a box that although it does not fit into the trunk of the average car, it will fit nicely into a minivan without even removing the seats. Once you get it, gather the family around the bedroom, and let them watch the show as it comes out of the box rolled up like a tamale and becomes a full fledge mattress. A good mattress. I recommend it.",4 out of 5 stars review
12/3/2023,The mattress is very comfortable and looks well made. It is almost perfect but unfortunately there is a yellow stain on top that became visible after opening the mattress.,4 out of 5 stars review
3/28/2021,good product for the price.  I've had this mattress for 11 months and it's comfortable. However when it arrived I removed the mattress from the box it came in and there were scuff marks on the side  of the mattress.,4 out of 5 stars review
7/15/2021,"Purchased based on other reviews. Nice firm support, for an 8 inch mattress. My son, 220,  is getting great nights of  sleep. I like the coils and foam combo. Free shipping, arrived within a few days. JB Chicago",4 out of 5 stars review
12/13/2016,Twin Mattress unrolled quickly. Left it open over night. There was no smell by next morning. Has been used for 2  weeks now and is comfortable. Have just ordered another one to replace another old mattress.,4 out of 5 stars review
6/6/2016,"For the price, you can't beat it. On the firm side and very comfortable. We needed a king size for a bed in the basement, so the box made it so much easier to get downstairs.",4 out of 5 stars review
1/3/2017,I ordered two twin mattresses for captain platform beds. The fit perfect and my two boys age 2 and 4 have no problems sleeping - I actually napped a few times and mattress was surprisingly comfortable. I highly recommend,4 out of 5 stars review
11/18/2022,"I think for the price you cannot beat the bed at all! I am not very hard to please though, and again the price was really good.
My discrepancy is more with the shipment company because they seem to have probably mishandled it before it got here and so it had a little indention on one side when expanding out but with time it kind of worked itself out for the most part.
So if you need a mattress for a guest room or you just need a new mattress for yourself and you're not wanting to pay much right now then pretty good deal for $120 a full size.",4 out of 5 stars review
9/12/2016,"So far the mattress is good price, thick and nice.  But not on the firm side, so i gave it four stars.",4 out of 5 stars review
8/28/2016,"Excellent mattress, it comes in a box and when you open it expands out. Wonderful.",4 out of 5 stars review
7/21/2023,Got for my man and he loved  it just want it to be more fluffy.,4 out of 5 stars review
7/21/2021,I ordered a full size. The shipping was delayed so  it took over a week to deliver.  The bed was comfortable and good enough. I would  recommend for guest room or kids/teenagers.,4 out of 5 stars review
9/10/2022,"The mattress is fine! It's everything I wanted and it's comfortable to me, but I do not like FedEx. The box of my mattress was left open in the blistering heat in the middle of my driveway!",4 out of 5 stars review
10/17/2018,"For the price you can't go wrong, but please note this bed is pretty FIRM.  I am 7 months pregnant with back pain and my husband has back pain, we've only had this a week and it feels OK, but very firm. However, I hear firm is better for back pain. We bought a fluffy $65 down mattress cover and I think that will help a lot. You can't beat this price though.",4 out of 5 stars review
6/28/2021,these mattresses are awesome I purchased too for my grandkids full size for the bed I can't believe the quality of them very nice,4 out of 5 stars review
9/2/2022,"I only have one issue. It's either the boxing or the delivery. The box broke outside my apartment. It there wasn't a plastic wrap (and thank god for it), it would have gotten dirty.",4 out of 5 stars review
2/18/2020,"I received my mattress today and I am unpleased... when I received the mattress the box was open outside in the snow/rain... it was delayed twice... 
the mattress itself looks to be good but I would be happier if the box wasnt open....",4 out of 5 stars review
10/8/2016,"It arrived within 1 week of ordering, which was great! The box was a little bigger than I anticipated for some reason but I was still able to move it by myself. As soon as I pulled it out of the box it started to inflate, once I took off the tape holding it tight it just popped open! Moved it into position and was able to sit on it right away, after 6hours we were able to enjoy it for bed and couldn't of been happier! We were in search of an affordable mattress since we didn't/don't have a ton to toss into a mattress right now with 3 kids and having just moved, after reading all the reviews we decided to give this one a try and it was worth it! So far it's wonderful, we are actually getting a full night of sleep vs what we were getting on t...",4 out of 5 stars review
5/24/2011,"My children needed a full mattress for a bunk bed that we also purchased from Wal-Mart. We all were a little skeptical because it came in a box, but it worked out really nicely. Be sure to put it where you would like it before unwrapping it because it's easier to move in the box. It takes about 20 min to fill out and be comfortable. It is a little soft, but is a great buy in comparison to other mattresses this thick. Give it a try, you'll enjoy the rest!!",4 out of 5 stars review
5/3/2011,"I was really surprised when I saw the package it came in I was wondering ""Is this a Queen size Mattress, impossible?"" but when I took it home and after assembling the frame to put it on, I was very amazed of how vacuum packed it was and of course how it expanded once the wrapping was removed. For my use this is a very comfortable buy and sleeps excellent for the money you have paid. I recommend this mattress for anyone just starting out or as an second bed for the house.",4 out of 5 stars review
3/13/2013,"Ok first I have to say that it took a little over week for my order arrive to my local store which is about 5 minutes from my house. With that said, I have to say I was a little skeptical like many other customers were, but after reading all the positive reviews I finally decided to get it. When I got to the store I saw how big the box was and was like OMG how am I gonna get that in my car! I purchased the Queen size mattress in the box plus the metal frames so I had two huge boxes. I did manage to get both of them in my car thanks to the Walmart employee who was very nice. My husband and I managed to get it up to our third floor Townhome as it was a little heavy. We cut the tape around it off and there is goes starting to inflate. I was SH...",4 out of 5 stars review
4/13/2017,"I recently moved and needed a new bed  so I ordered the queen size. It was really easy to inflate and has not deflated since I started sleeping on it a month ago. I will agree with one of the previous reviews that it is a little bit too firm. Luckily, I had a gel soft foam eggshell type deal that I put on top, flat side up. It's the perfect mix of having a firm foundation with the perfect amount of softness to it. My boyfriend says it's the most comfortable Matress he has slept on even more than his own bed. It's a good deal for what you get! Frame also bought from Walmart.",4 out of 5 stars review
9/2/2017,"This review is for a TWIN ""Slumber 1 - 8'' Mattress-In-a-Box"" purchased in August 2016. I've been sleeping on it for just over a year. I am 6'1"" and weigh 150 pounds. Would I buy it again? Probably, but I sure wish it was firmer.

Positives

Price: I paid $99 + $6 tax for a total of $105. I replaced a popular name-brand mattress whose current (9/1/2017) advertised price is $652.

Free shipping.

Shopping convenience: No having to shop in retail stores.

Delivery convenience: No hassling with transporting the mattress, paying for delivery, or even having to be home when it is delivered. The box was left standing beside my front door.

No strong odor. I am sensitive to strong odors and was pleased that the mattress didn't stink.

Silent. On m...",4 out of 5 stars review
1/6/2024,I got this for my daughter when we upgraded her bed size. It arrived super fast and packaged perfectly. It didn't take long to fill out once out of the plastic and she says it's the best sleep she had had in a long time. Her little brother even has been sneaking into her bed to lay on it.,4 out of 5 stars review
1/6/2021,Seems like a good product since my kids like to be bouncy and it seems to be comfy my daughter likes it shes 10,4 out of 5 stars review
6/30/2020,The package was dirty and torn. The mattree was intact and nicely packed. It inflated immediately (check the photos). Overall satisfied. Matched it with a zinus platform bed.,4 out of 5 stars review
3/25/2014,"Day 2.. So far so good! Mattress expanded in 10 min or so, it reached more that the size I ordered (8""), see pictures. Mattress is firm but comfortable, design on it looks good. I'll make an update 6 months later. Got questions?, ask me!",4 out of 5 stars review
5/10/2016,We are so surprised at how comfortable this bed is. We bought it for our 16 year old son and he loves it. It comes rolled up in a box and quickly springs to life after unrolling. Amazing!,4 out of 5 stars review
9/13/2015,"I had been searching for a decent, inexpensive mattress for a while now, but worried about the trade-off for quality and comfort. I stumbled across this mattress, and after seeing other reviews and being happy with the price, I decided to purchase it.

It arrived via site-to-store very quickly. It was rolled up and vacuum-packed in a box (roughly 60lbs; the box was able to fit into my sedan). It was easy to open and get set up on my bed frame by myself. It didn't really have any noticeable odor unless you put your face right up against it. I let it air out for several hours, but the instructions recommend letting it fully expand for 48 hours. However, seeing as I had nowhere else to sleep, I slept on it that night. It was ""fluffy"" enough at...",4 out of 5 stars review
6/27/2016,"Wow, I love this mattress! I was very reluctant to purchase it but I only wanted it for a spare bedroom. I loved it so much I got a second one for my own bed! I have not been bothered with my every morning back ache since I've been sleeping on this mattress! Very surprised at the size of the box it arrives in but I opened it and let it set for 2 days and it is perfect, no smell at all and nice and firm. Love it! Definitely a great buy!",4 out of 5 stars review
9/26/2016,"After reading through many reviews I decided to get this for my 10 yr old son who complains that his old mattress was just not comfortable anymore . Being 2-3 times more expensive no less. It came packaged perfectly, easy to open and set up. I let it set for a day before use . Kids both agreed it's much more comfortable and even I slept in it over the wknd. A definite must if you need a new affordable mattress.",4 out of 5 stars review
10/9/2016,"The mattress arrived on time and was easily maneuvered  upstairs and atop the bunk bed.  My grandson was anxious to sleep on it that night so 4 hours to ""reboot"" was all the time we gave the mattress.  Plenty of time for the air to ""fill"" the mattress back up.  No fumes, everything was fine.  The 12 year old twin boys take turns sleeping on it, and are comfortable.  I climbed up there and found the mattress to be quite comfortable.   Pleasantly surprised in the comfort  as I really was just filling a void.  I had just purchased the bunk ( from Walmart) and needed the twin mattress.  I'm considering replacing the bottom ( full size) mattress with one from this same manufacturer.",4 out of 5 stars review
9/19/2013,"I ordered the Full size mattress for my 12 year old daughter and she loves it...it is very comfortable. it was so easy to do. you open up the box...remove the plastic and like magic the mattress starts to form right before your eyes. we waited 1 hour before we laid down on it. we wanted to make sure it was fully inflated. We had ordered a twin size slumber 1 mattress also 8"" about 2 years ago and we couldn't be happier with it.",4 out of 5 stars review
9/17/2016,"I have the same mattress for all members of my family. It's nice and cheap and we get a good nights sleep on it too. I like the fact that it comes in a box so I can choose to collect from store without worrying if it will fit in the car or not. The only downside is that you can not turn the mattress over every couple of months as you are supposed to because only one side has cushioning enough to sleep on. You could just rotate it so it doesn't wear in one place though, that would work.",4 out of 5 stars review
8/22/2023,"Very comfy, perfect balanced between firm and soft. 8"" really is enough unless you want that ultra soft sinking feeling. The only thing is that there's no edge support so you don't want to sleep too close to the edges, but it's good for the $125 price. (Also please buy a queen size bed if you are over 5'11"", my feet are always hanging outside of the bottom edge, I really regret saving that $50 and it's too frustrating to return a mattress so I'll just have to sleep diagonally...)",4 out of 5 stars review
3/15/2017,"I purchased a king size mattress-in-a-box and give it high marks. It was exactly as advertised and an excellent alternative to much higher priced mattresses. I wanted an economical mattress as I planned to cover it with 4"" memory foam. The combination is better, imo, than a mattress costing 10x as much. Don't be afraid of buying one of these coil spring mattresses from Walmart, they are an excellent option. The delivery took longer than 2 days, as advertised, and they apologized and issued to me a 5$ voucher. And shipping was free! I would recommend this mattress to friends and would purchase one again!",4 out of 5 stars review
1/27/2012,"Very pleased with this mattress. just as comfy as one of those high end brands.

I, however, was mislead to believe that with this mattress, a boxspring was not needed. I have a small metal bed frame that I brought to college with me and picked up the mattress after I moved into my new apartment. After putting the frame together, I put the mattress on the frame and the mattress fell right through the frame. The whole reason for me buying the mattress was so that I didn't have to buy a boxspring.

Overall, the mattress sleeps great, even just with it on the floor.",4 out of 5 stars review
11/17/2016,"I read almost half of all the reviews on this mattress before I purchased it. I liked that most people thought it was a great value for the price and offered ""solid"" body support. I agree, however it should be noted that as a previous reviewer said, ""the edges of the mattress have more give"" than a standard mattress. That means if you do a lot of sitting on the edges of this mattress you will sink down quite a bit. If that's not a big deal to you than this mattress is one of the best deals around!! Before I purchased this mattress I suffered from terrible back aches (so bad that sometimes I would have to go sleep on the couch to get a good night of sleep). I haven't had a single back issue since I started sleeping on this mattress-it's been...",4 out of 5 stars review
10/5/2016,"The size (approximately 3 to 4 feet in length and two in width is my guesstimate) made carrying the box a little awkward but my 14 year old son managed to get it from the car into the house with only one pause to make an adjustment (he mentioned if the box had handles it would have been much better.)

Upon opening the box we were amazed at how well vacuum-packed it was.  Essentially it was folded in half and then rolled up.  After marveling at it for a bit we opened it up and watched as it began to inflate.  In the whole opening ceremony my kids lost the paperwork/instructions so I took the advice of the friend who had recommended it to us and let it expand for 3 full days. We just set it up last night and last night was its first sleep.  
...",4 out of 5 stars review
6/6/2016,"Only complaint I have is with  Walmart.  This mattress was too heavy and large for an older woman to handle.  This should have been able to be shipped to home. 
The mattress itself is comfortable for me. It is  very firm, so if you need more give  I would suggest getting a  thick mattress topper.  I didn't notice  any odor when it was unrolled.  I let it reinflate for 24 hrs.,  but it only got to 6 inches  instead of the 8 inches.  Not a big deal for me.  It sleeps comfortable,  and finally my feet don't hang off the end of the bed!
So far I am  satisfied.",4 out of 5 stars review
1/23/2013,"I like soft mattress as to a firm one. This one is very soft and is cheaper than a firm one. I can easily fall asleep on a soft mattress. I would recommend it to anyone to get a 10"" or 12"" thick unless you have a box spring to support it. I got a minimum thickness of 8"" (actual thickness is less) but not as good on a slat bed support. I recommend 10"" or 12"" on a slat bed support.",4 out of 5 stars review
12/23/2013,"I bought this mattress because my son had been sleeping on my old one for 10 years. Old one had a sag in middle but didn't bother him because he was so lighweight. He's 22 now and at an adult weight so his back was bothering him due to the rut. I looked at regular mattresses and they were way out of my budget. I decided to look at Wal Mart and found this for around $200.00. When it arrived in that small box I said, oh no, what have I done. We opened it up and poof, it immediately expanded to a normal size - so crazy! First he said he loved it, then he hated it. I told him to give it time as he had been sleeping in a rut on the old mattress and this new one was firm. Next day, I asked again.....he said he absolutely loved it! I did however j...",4 out of 5 stars review
7/29/2023,"Came fast, easy to get out of box. It looks nice, but after sleeping on it a few nights it's a little too firm for me personally. I was on a tight budget and got this one for the price and thought hybrid would be a good fit. I'm going to get a topper hopefully that helps.",4 out of 5 stars review
8/31/2013,"This bed was everything that I expected. This is the second Mattress-in-a-Box I've purchased. I originally purchased a full sized one a few years ago but I wanted to upgrade. So I sold the full and bought the queen and I couldn't be happier. However this time around it looks like the mattress wasn't made with the same materials. This latest version doesn't have the satin finish like the original one I had. The material is more of a full cotton, almost plush tissue-like material. Still equally as soft but not expected. The only complaint I had with this mattress was that it came with a stain on it. The stain was negligible however enough to annoy me. After opening the product however I didn't feel like having to troubleshoot how to ship it b...",4 out of 5 stars review
9/26/2014,This mattress is what I was looking for (a regular size mattress) with comfort. With this mattress coming in a box is one great surprise; follow the instructions and you'll have one great mattress to full form in about a day. I have had this mattress under a month; molds to one's body and bounces back...no sagging of any kind and I am over 300 lbs. Very firm and I have appreciated the full nights of sound sleep. The mattress is used on my new Premiere Bow Flex Bed Frame. I'm happy thus far. And there is a great warranty.,4 out of 5 stars review
7/28/2023,"Good mattress, got it for my 10 year olds canopy bed. Fit perfectly, good quality and she thinks it is super comfy, ONLY drawback is the horrid smell!!! I let it air out, I open her windows and now I've resorted to spraying perfume on the bed. I'm considering buying a different mattress if this smell doesn't clear out soon.",4 out of 5 stars review
8/13/2023,"I like the feeling of the bed, a bit firm but I like it (I'm not too picky) it definitely helped my back A LOT, before this bed, me and my boyfriend were sleeping together on a twin and it was horrendous. I jus got my first apartment so I'm starting from scratch. Only thing about it is it's not very thick like the $1000  beds we saw at mattress firm so we need a box spring since the bed frame I brought was lower than I expected but I still give it a 9/10.",4 out of 5 stars review
7/27/2016,"I was looking for a reasonable price twin mattress for my father-in-law .   He wanted something less than 150.  After researching walmart's website for mattresses the Slumber 1-8"" mattress-in-a box had many very good reviews.  So I took a chance and bought it with the Spa Sensations steel Smart base bed frame.   It arrived within the week.  I could not believe the mattress fit in the box.  I was a bit scared it would be damaged.   To my surprise it turns out the mattress was well wrapped and unrolled perfectly fine.  I laid it out for 48 hours to flatten the mattress and allow my grandfather to sleep on it.  The next morning he said he slept very well.  Ever since he has been taking multiple naps during the day, and enjoying the feel of it....",4 out of 5 stars review
2/8/2024,"Very comfy and you get a good night rest on it. It's for my 6 year olds room, but I have napped on the mattress best naps ever !",4 out of 5 stars review
11/4/2023,Not the best mattress in the world but it is definitely worth the price and it is comfortable. This is my second time buying the mattress with the first one lasting 5 years.,4 out of 5 stars review
11/17/2023,"Mattress topper fit perfectly on my bed. it adds extra softness that I wanted. Only negative is when you sink in it's really hard to change positions, a indentation stays for a while?",4 out of 5 stars review
12/17/2023,"we bought this for our daughter's new bed and its very comfortable for her, however,  no regular sheets fit it. the lenth is ok but the depth is weird and the sheets sit loosely.",4 out of 5 stars review
12/18/2023,Very pleased with this mattress for the price. Bought for my son %26 he loves it. Followed instructions %26 waited 3 days for it to complete regain it's shape before using it. Just bought another one for my daughter.,4 out of 5 stars review
11/17/2023,Good quality only complaint was the price apparently changed between putting it in my cart and paying so I paid more but my fault for not triple checking,4 out of 5 stars review
10/28/2023,the only thing I think that could make it a better mattress for the value would be a little thicker topper on the mattress other than that I'm really pleased with it.,4 out of 5 stars review
10/29/2023,"Unpacking was smooth. Definable serve the purpose. I like firm bed and this is exactly as I expected. Product is HEAVY, hence difficult at times whenever you will need to move it, can be moved by one person though.",4 out of 5 stars review
