date,text,stars
9/17/2023,After the 48 hour so it could decompress I put it on the bed put sheets on it and it was the best night's sleep I had in a long time. to be truthful I don't remember going to sleep. The Old mattress that I had I paid twice as much then I paid for this one. and it's a 100% difference between the two mattresses. I was a little skeptical when I seen the price but I'm so glad that I decided to buy it.,5 out of 5 stars review
9/6/2016,"After sixteen years of marriage and five kids, we decided it was time to upgrade our bed to a king size mattress. We had continually put off this purchase because of the cost of buying a new one. A month or so ago, my sister recommended this mattress from Walmart. When she told us how inexpensive it was compared to most of the mattresses on the market, I was skeptical–but also very interested! In the end, we decided to purchase the mattress because we needed a king bed, we couldn't beat the price, and we figured that worst case scenario it would last a couple of years and then possibly need to be replaced.

While I can't comment on the longevity of the mattress, in the three weeks we have owned it we have been extremely pleased for the foll...",5 out of 5 stars review
3/25/2017,I purchased the mattress a little over a month ago. I mindfully wanted to wait atleast 30 days before I gave my review. The package did not arrive at the original delivery date which was unexpected because I never received an update w/ a change in the delivery date until late that same day at night.  The original delivery date was a Friday and it came on a Tuesday  ( Walmart gave me a gift card on there own accord for the delay.. not bad at all ) Now the mattress comes to life as soon as you set it free... The mattess is much better quality then I honesty expected because of the price. It is a Great Quality soft but firm mattress if that makes sense. I sleep great on the mattess... The mattess is exactly what it is described to be.,5 out of 5 stars review
3/22/2020,"Omgggg!!!!! This is so nice for the price. I was worried for the price it wouldn't be that great, boy was I wrong. It said to allow the 24 hours to fully recover but only took about 5 min. The bed is super comfy and soft! Best Buy from Walmart.. so great I logged on to make my first review. Thank you! And the warranty is a bonus!",5 out of 5 stars review
2/16/2024,I have the twin in my second bedroom.  I got the fullsize for the main one.  Once again I am a happy customer.  Best night sleep ever.,5 out of 5 stars review
2/11/2024,We bought 4 of these mattresses when we moved into our new home for our kids. They are so comfortable %26 a great size for kid beds!,5 out of 5 stars review
11/25/2023,I read the reviews and was kinda skeptical about purchasing these mattresses. But for $89 dollars for a 8 inch I took a chance and I'm so happy I did.,5 out of 5 stars review
11/18/2023,"The bedding feels soft, was easy to bring up my room and get it set up. My fiance and I are definitely happy with this buy, I can finally sleep better.",5 out of 5 stars review
11/2/2023,Arrived on time.  I followed all directions and within seconds the mattress expanded.  Much to the horror of my cats!!  I will give it another day to get set up and then redo my bedroom.,5 out of 5 stars review
11/9/2023,"This is a great mattress, It puffed up as soon as I unwrapped it. Can't see how anyone can complain about it. plus it came in two days. It is super comfortable.",5 out of 5 stars review
11/9/2023,I bought this for my toddler and he loved it! Very easy inflatable once plastic was opened. No complaints very nice bounce not hard at all. Good price for 150. Walmart never fails me!,5 out of 5 stars review
12/6/2023,Performance /price is definitely worth it. No body expected more that. If you looking for more comfortable luxury I recommend new style memory foam and cooler materials mattresses search,5 out of 5 stars review
11/4/2023,"first mattress out of a box for me. i needed a twin, cheap and quick. got all 3 and a pleasant surprise as well. not been a week yet and i sleep like a baby. check back in e months",5 out of 5 stars review
12/24/2023,The order came on time. The Matress is amazing. so comfortable. It was on sale really cheap. I was worried it wouldn't be real good. I was totally wrong. Made to last a very long time.,5 out of 5 stars review
11/16/2023,Packaged arrived on time was a little beat up but mattress was packed very well. For the price this is a great deal! Very comfortable just needs some time to set and arise.,5 out of 5 stars review
11/2/2023,"I love the kung fu kick of unrolling. inside joke, It love the feel and the firmness of the mattress, but it still has 24 hrs before its completely decompressed. Overall love and recommend this mattress. No matter the price its worth it.",5 out of 5 stars review
12/11/2023,"I was pleasantly surprised with this mattress. It's very firm and inflated nicely. The instructions say to open it within 72 hours of delivery to ensure full inflation, but I kept mine in the box for 2 weeks. I'm very happy with it!!",5 out of 5 stars review
12/8/2023,This bed is really comfortable. We bought it for our 5 year old and are about to order one for our 3 year old. Great price and quality. I can sleep comfortably on it too. Definitely recommend,5 out of 5 stars review
12/13/2023,this was a gift for my brother. he has said multiple times that its super comfortable. its a medium firmness mattress. great for sore backs and hips .,5 out of 5 stars review
11/8/2023,"This mattress was for my son and he loves it! Took about 3 days after the foam fluffed out for him to ""get used to it"". It's soft and holds its shape , allows you to move without sticking to the bed. It's wonderful!",5 out of 5 stars review
10/29/2023,I can feel the springs thou the bed. It's hard not what you think that describes here. Maybe next time I will spend more money on another bed that cost more.But shipping was fast and on time !,5 out of 5 stars review
11/3/2023,I bought this mattress on sale for our guest room for $98. I slept on it last night because of my husbands snoring. So so comfortable. I 10/10 recommend,5 out of 5 stars review
12/21/2023,The mattress came earlier then expected.  Easy to unfold take out of plastic and watch it pump up to size. with the frame I bought you do not have to use platforms with it. But I had some already.,5 out of 5 stars review
11/23/2023,"Pleasantly surprised.  This is a firm mattress which is what I was looking for. Great quality and comfortable. This is my first time buying a mattress in the box, will definitely buy again.",5 out of 5 stars review
11/26/2023,I was very pleased with this mattress. It is very comfortable. It is in a room for guests but I napped on it and it was great. Soft top and spring support.,5 out of 5 stars review
11/18/2023,"This is not really a hybrid bed, but the springs are very comfortable and quiet and I would buy it again it's a little softer than I thought it was going to be but I still love it!!",5 out of 5 stars review
12/14/2023,My grandson needed a new and a size bigger. I ordered a platform bed and this mattress. He went up from a twin for him and his lab. They're both a lot more comfortable!,5 out of 5 stars review
11/3/2023,This is the second purchase of this mattress. Bought it for the guest bed.  If you like a firm mattress its a good one.  Cant beat the price when on sale,5 out of 5 stars review
8/23/2011,"King mattress is comfortable, and it arrived vacuum sealed.
Nice and clean wrapped in plastic.
Delivered on time.",5 out of 5 stars review
2/25/2017,This is a great mattress!! Bought it for my wife and I master bed room and it looks and feels amazing! I will definitely recommend it to a friend!,5 out of 5 stars review
12/30/2023,"Super easy to build and comfortable. I loved it. I was sleeping on the floor for like 2 weeks, I'm so happy this came literally next day.",5 out of 5 stars review
1/10/2024,I absolutely love my new mattress. It fits my room perfectly. Its not too hard and not too soft. I sleep so much better now.,5 out of 5 stars review
12/28/2023,I love how easy it was to get my mattress in my 3rd floor apartment. After a few hours the mattress laid flat with no bumps or crease,5 out of 5 stars review
12/30/2023,Bought as a Christmas gift for my teen son. He was able to build it easily and loves the aesthetic. He says he doesn't feel like a baby anymore.,5 out of 5 stars review
1/2/2024,"I sleep so comfortably 😊😊 thicker ghan I expected 
Recommend to my mom who has been complaining about body pain and suggested she purchase",5 out of 5 stars review
9/25/2016,"I don't like my mattress too soft, so this one is perfect for me. And free delivery just made everything much easier! Overall, like everything about the mattress and would definitely recommend to my friends. :)",5 out of 5 stars review
9/23/2023,I bought this for my 5 year old (shes too tall for her age and it made sense to skip the toddler bed) %26 she loves it. it's really comfortable. You cant feel the springs or anything. Worth every penny!,5 out of 5 stars review
8/15/2023,"I bought this for my camper and it was so comfortable I bought one for my daughter who is away at college. She said she slept through the night for the first time since being in her dorm, over a year ago!",5 out of 5 stars review
8/25/2017,I had a Serta perfect sleeper mattress that broke after one year! The one I bought at Walmart was so much better and way more comfortable and durable! I can sleep again...lol,5 out of 5 stars review
7/5/2017,"Awesome mattress, first bed I bought and it did not let me down! Super comfortable to sleep in and the size was perfect for two people. Hoping to buy the same kind of mattress when I move back home to California.",5 out of 5 stars review
8/28/2023,This mattress is very comfortable. It's firm yet offers an abundance of gentle comfort for a good night's sleep. The quilted cover adds a touch of luxury.  I'm very satisfied with this hybrid.,5 out of 5 stars review
10/24/2023,"Feels amazing and easy to unpack. The mattress is a bit heavy but definitely durable.
I bought this mattress for the top bunk of a bunk bed. The mattress is thicker than expected but fits fine since their are guardrails.",5 out of 5 stars review
3/21/2017,Easy convenient way to get a new mattress without having to run all over.  Delivered right to my door.  This is the second one I have had and I love it.  Firm steel coils with memory foam top for comfort.  Got here quick.,5 out of 5 stars review
8/22/2023,Bought for the bottom bunk of my kid's bunk bed and it's very comfortable. Not too soft but not too firm. Managed to get this on sale for a great price,5 out of 5 stars review
10/25/2023,The Mattress is comfortable and soft enough 2 sleep on for a good night's rest so I would definitely recommend it 2 other shoppers in need of a new mattress!,5 out of 5 stars review
7/10/2016,"Bought this for my daughters first 'big girl' mattress. It is comfortable, easy to maneuver and inexpensive. Bought the same one for my son three years ago and it is still in great shape",5 out of 5 stars review
8/15/2023,I would buy this mattress again and again. Perfect mix between soft but not too soft. I was skeptical with the price and it being a box mattress but I have no complaints 4 months in,5 out of 5 stars review
3/20/2017,When it first arrived in the little box and I pulled it out I thought there was no way this was going to be a good mattress.  After letting if expand I was pleasantly surprised. My daughter loves it!,5 out of 5 stars review
9/30/2023,"So far so good! The mattress itself is fairly comfortable, we added a mattress topper for a little extra softness but honestly wasn't needed that much.",5 out of 5 stars review
2/10/2018,"I love how it feels when I lie down. Firm so it doesn't sink like the airbed I had to use for a week after I got my taxes back, but also soft enough so when I go to bed I am out for the night. I love it!",5 out of 5 stars review
3/21/2017,Bought these for the twin beds in my spare bedroom. They had been recommend by a friend and I am very happy with them. My grandson said they are better than his mattress at home that came from a major furniture store.,5 out of 5 stars review
3/14/2011,"Mattress is extremely comfortable. My mom sleeps on it when she visits and said it is as comfortable as her sleep number bed which she paid $3000 for. I have arthiritis, sleep on it nightly, and awaken in no pain. Great product!!",5 out of 5 stars review
8/9/2014,"My wife's back got better with this mattress. I thought it a bit hard at first but have gotten used to it
in less than a week. It helping my wife's back is worth the price. We got it for our travel trailer.",5 out of 5 stars review
7/15/2020,"Very happy. Medium firmness (not sinking in soft but not straight firm). 8 inches is good, cant feel like springs etc. Love it for the price. 

If you like medium mattress then you will love it.",5 out of 5 stars review
6/26/2016,I have purchased several of these types of mattresses.  Amazing how comfortable they are.  My husband said it is the best mattress in our house and we have a $6000 dollar mattress on our bed that is awful!,5 out of 5 stars review
9/30/2023,I was very surprised that a mattress that cost so little was a great deal. I slept wonderful even on my side. it was very easy to set up from the box. I totally recommend this mattress.,5 out of 5 stars review
10/13/2016,"This mattress is great and is a full 8"" high which fits my sheets much better than the thinner ones. Sleeps like a dream and incredibly reasonably priced.",5 out of 5 stars review
10/18/2023,you cant beat the price for this comfy bed i have fibromyalgia and rheumatoid arthritis and this mattress is amazing!!! Ive never been disappointed with Walmart.com,5 out of 5 stars review
3/24/2017,"I was pleasantly surprised.  This is a very comfortable mattress! To me it is the perfect comfort level. Not too soft, but not firm either. It came in a box and it expanded to the average size mattress. I'm glad I made this purchase.",5 out of 5 stars review
3/24/2014,"I have serious back problems and needed some relief on my back at night,BEST BED I HAVE EVER SLEPT ON!!!!!THE SINGLE COILS ARE LIKE GETTING A MASSAGE WHILE YOU SLEEP...I LOVE MY BED!!!BEST 200.00 I HAVE SPENT...",5 out of 5 stars review
10/28/2010,"I was worried when I ordered this matress, however, when I got it I was mesmerized: it was just like I expected, firm and equal to the task! I will order this, again and again, if need be. Technlogy is awesome!",5 out of 5 stars review
6/20/2016,"After waiting the suggested time of 24hrs. It was well worth the wait. Yes I was a little
skeptical of ordering a mattress in a box. It was a good purchase. Much easier that the 
mattress on top of the car. It has the firmness promised. Simply great",5 out of 5 stars review
9/26/2023,Love the bed super comfy and you just let it rise for 2 days (style or on it the first day) but on the 3rd day it was extra comfy. Arrives in a box and wasn't hard to get through the door — it was wrapped amazing,5 out of 5 stars review
10/22/2023,"I've purchased three of these! A queen for our camper, then a queen for my college daughter, and now a king for my home. No more $5000 mattresses for me.",5 out of 5 stars review
10/21/2023,"My granddaughters are so excited for their bunk bed mattress… one twin on top (where grandma will sleep 😴). And full for my 2 older grandkids. (5, 3, 1)",5 out of 5 stars review
8/11/2023,"Love this mattress! Bought it for my son in 2020 and it's been great! When guests stay, they use this mattress also and each has raved about how comfortable it is. Just bought a second one for my daughter who's transitioning to a big bed now too.",5 out of 5 stars review
6/8/2023,"I needed a mattress for my sister who was coming for the weekend.  I ordered on Thursday it arrived on Saturday.  It came in a box.  All I had to do was shake it out of the box and cut off the plastic.  It expanded to an 8"" full size mattress. It is quite comfortable.  The perfect bed for a weekend guest.",5 out of 5 stars review
3/19/2023,"I wasn't sure what to expect when buying a bed online for my kids. However this bed is the most comfortable bed and I'm low key jealous of my sons 😂 it's like ur sleeping on a marshmallow. It's not to hard, not to soft, and best of all my kids are sleeping through the night!!",5 out of 5 stars review
5/16/2023,"I had bought this same mattress in a queen size for our camper. I noticed how well I slept and how my back pain disappeared. So, I decided to replace my $2200 king size mattress in our bedroom. I love it and it was very affordable. I would recommend it to everyone.",5 out of 5 stars review
6/26/2023,"for the price you really cant beat it, this was my first time buying my own mattress so i was looking for the best deal but also a good quality bed, ive slept sooo good since i got it! im so happy! if your thinking about getting it do it, you wont be disappointed",5 out of 5 stars review
2/17/2024,It was delivered super fast and it was amazing fit I love it,5 out of 5 stars review
2/1/2024,A very good buy Sleeps comfortable with room enough for two people.,5 out of 5 stars review
2/11/2024,was sleeping on an air mattress for 3 years.  Sooooo much better.,5 out of 5 stars review
2/3/2024,Got this for my 3 year olds loft bed and it's nice and comfy,5 out of 5 stars review
2/2/2024,very comfortable.  worth the money,5 out of 5 stars review
2/1/2024,"much more than I expected, 100 percent satisfied",5 out of 5 stars review
2/8/2024,"Excellent mattress , would buy again",5 out of 5 stars review
7/1/2014,"This is the second Slumber 1 Mattress in a box I've ordered. The first I've had for 3+ years now - still super comfortable and supportive. My most recent purchase was for my teen son. He seems pretty pleased.
Mattress set up is easy - make sure the frame is set up before you open the mattress packaging as it begins to expand immediately. Mattress does have a slight unpleasant odor immediately after opening. A quick spray of febreze and the full 24 hours of expanding time cures that.",5 out of 5 stars review
4/5/2014,I have been struggling to find a comfortable mattress that allows me to get a full night of rest. I tried the foam ones but just found them to be too firm. This mattress is a perfect balance between plushness and firmness. I would highly recommend it.,5 out of 5 stars review
4/28/2013,"I was amazed to find this type of mattress so cheap at Wal- Mart .com. The cheapest mattress at my local furniture store was 3 times as much as this mattress and it was just a regular spring mattress. This mattress is so comfortable and very cheaply priced for the quality. I would definitely recommend that you get this mattress. If you like pillow top mattresses, I saw a mattress like this with a 2 inch pillow top on it for only $20.00 more.",5 out of 5 stars review
1/31/2017,"First mattress we ever bought in a box.  It arrived as promised.  We opened the box, placed it on the bed and removed the wrapping.  Immediately heard a whooshing....sound while the mattress unfolded and started to raise up.  We bought the twin size for a daybed.  Our Granddaughter sleeps on it and says it is ""wonderful"".  It is crazy how it comes in a box then puffs right up.  Per the instructions, we waited 24 hours to sleep on it although I believe it was ready to go in 1-2 hours.  All the good things we heard about this mattress-in-a-box seem to be true.  Also had the lowest price of all mattresses we researched.",5 out of 5 stars review
5/13/2020,"Comes compressed in a box. Open it/roll it out, and then cut the edges of the compression wrapping and let it expand for 2 days. Once its ready, the bed is comfy and firm.

Do yourself a favor and buy a good quality bed wrap to zip it up in as well, so the bed will stay good and fresh for years to come.",5 out of 5 stars review
2/5/2015,"This mattress has the best of both worlds, the body contour ability of all foam, and the firmness of coils. I love my all foam mattress, but my daughters hate it. They have no problem with this one, apparently because the coils give enough support while still providing the benefit of the foam softness and ability to contour, somewhat to the body. Everybody's happy!
Delivery and set up couldn't be easier; price is great. It's a win win.",5 out of 5 stars review
12/10/2012,"This is my second one. They are great to sleep on. I had one on my bed and when I moved from FL to MO I sold it with my bedroom set. The friends that bought it say they like it very much. Once settled I ordered another one for my new place. For the comfort and convience you can't beat the price. I use mine every day. There's no way at 63 years young I could handle a full size mattress on my own. I was going for the convience when I bought the first one, but after sleeping on it for 6 months I knew I would have to replace it with the same product when I moved. Always carefull when opening it, but other than that they are the only way to go for comfort.",5 out of 5 stars review
11/5/2016,"This was an early Christmas gift to my daughter and her husband.  The night after they got to sleep on their new mattress, I asked how was it?  My daughter said. ""Oh Momma it was like sleeping on a cloud!""  Thanks for the speedy delivery. Thanks for the way it was packaged so as not to be too huge. Thank you for the on line shopping, it is so very convenient.",5 out of 5 stars review
3/14/2014,"So in a world full of different mattress choices, finding one that works for you can be time consuming and expensive. Sure, you can go to the big box stores and buy a $300 to $1000 plus mattress, pay to get it delivered, and the be full of regrets for the next 10 years. This mattress is just as good as other ""big box store"" brands if not better, and comes directly to your doorstep for free! If you are still reading this, stop reading and click the buy button.",5 out of 5 stars review
9/10/2016,"I am so impressed with this matress. I bought it on sale for $100. It is just as comfortable as a far more expensive matress. I ordered it for a guest. My father in law who has hip issues used it this past weekend and said he slept like a baby. Thinking of ordering anotherone even though I don't really need it. Wonder, wonderful mattress!",5 out of 5 stars review
12/27/2013,"I was a little hesitant to order a mattress online, but was pleasantly surprised at the quality of this very affordable product . It comes rolled in a box for convenient delivery, but expands once unrolled. I was worried that it would not have enough support, but it is actually quite firm and springy. I highly recommend the Slumber 1 and I'm very happy with my purchase!!!",5 out of 5 stars review
3/12/2014,I got one in king size almost 3 years ago & when it came time to get one for my daughter I wanted to get her one so she could sleep in the Spa-Cloud too... That's what we call it. It's not expensive. It won't leave a dent in your wallet. In these economic times budgeting to spend the least & get the best this mattress is a perfect investment. I'm now also getting one for my son who also needs a new mattress. The kids love seeing & hearing it get aired into a mattress filled. My son's Autistic so he had the biggest exitment seeing it fill in. This is definitely something I'd tell all my friends & neighbors. (And I have). You will not regret it.,5 out of 5 stars review
8/25/2013,This is the second Slumber Mattress in a box we have purchased and we have loved them both! The mattress is very comfortable to sleep on. My kids think they are very comfortable! I have slept on the mattress many nights and it is very comfortable. I would definitely buy this again when I need another mattress!,5 out of 5 stars review
10/25/2012,"i was having a severe back probems and have both other mattresses and it didnt help and i decided to let this be the last one i buy, well, my back is feeling SO MUCH BETTER. the first night i feel asleep so fast and it was so comfortable and i didnt even feel my wife get out of bed. well worth the money.",5 out of 5 stars review
10/8/2016,"this is my second purchase, the first one is working out so well and is so comfortable, I decided to replace another bed in the house.  I will be purchasing a queen size within three months. Very comfortable especially with the frame   I purchased as a set.",5 out of 5 stars review
10/8/2014,I bought this mattress for my elderly mother and she just loves it. Very comfortable and it was easier getting the box this is packed in into the apartment rather than a bulky mattress that I'd have to try to get there in my vehicle. Such a good deal.,5 out of 5 stars review
1/23/2017,Could not believe I could order a mattress in a box. I Live in the country 45 miles from a store with mattresses and do not have a truck.  Thought it over for about 6 months and finally just did it. Ordered Sunday morning about 2am received Monday 4:30 pm. I Have recommended it to many friends. It's GREAT!!!,5 out of 5 stars review
3/22/2017,"Mattress was shipped within 2 days! Perfect firm but soft enough for perfect sleep. I went to a mattress store before purchasing from Walmart.  The mattress at the mattress store had nothing on the one that was delivered from Walmart. Will order again should I need another mattress. Stop reading and go and order. You won't be disappointed, I promise!!",5 out of 5 stars review
