date,text,stars
11/6/2023,Don't buy anything from Walmart of this price online. they're asking me for a review for a TV I never received Vizio 65 in. I received a delivery of two boxes of fruit snacks and now I'm fighting it through my bank to get my money back. what a joke,1 out of 5 stars review
11/16/2023,The vendor did an update to make TV not work any longer and Walmart won't take it back. Gotta pay for those billionaires homes. Walmart is disgusting. At best. Do not ever purchase from them.,1 out of 5 stars review
11/21/2023,"The VIZIO 50"" Class V-Series 4K UHD LED Smart TV V505-J09 was not delivered to my mailbox or by my door! I was home all day Nov 18th and check my times for the package! 2 other packages from Walmart where deliver on that date!",1 out of 5 stars review
12/1/2023,This tv honestly sucks . It's big yes but it doesn't connect to the internet at all. I have to use the PlayStation to actually be able to watch stuff online.,1 out of 5 stars review
11/30/2023,Do not buy online or have it shipped in delivery. It will come broken. I got mine yesterday and the screen is cracked and can’t see anything on the picture.,1 out of 5 stars review
11/27/2023,"Driver for Roadie stoled my 65” tv Evelyn R what a disgrace to life you are about to lose the only job you have for a tv that's sad, once i find out who you are you'll be all over social media lol",1 out of 5 stars review
11/6/2023,"Speakers sound terrible on tv, they quit working after 30 days. I went to return it and it was 2 days outside of my return window. Wouldn’t recommend purchasing",1 out of 5 stars review
11/25/2023,"Great news! Items from your order were delivered at 1:53pm on Sat, Nov 25.  THIS ORDER WAS NOT DELIVERED  Order date: Fri, Nov 24, 2023
Order number: 2000114-71368475",1 out of 5 stars review
11/17/2023,"i received a broken tv. It has no damage that you can see, but it wouldnt turn on its acting like when your tv is dying it comes on real quick and turn off faster it came on.",1 out of 5 stars review
11/9/2023,"Beautiful tv.  Was disappointed after two hours trying to get it to work auto find out it wasn’t compatible with our cable provider, Spectrum.  Would be nice if it said this in the description - wouldn’t have purchased it!",1 out of 5 stars review
11/19/2023,I dislike that I didn’t even get my TV that was ordered and at this point I would like a refund I don’t even care for a TV because that’s not fair that I didn’t get it but it says it was delivered so the delivery guy must’ve taken my TV,1 out of 5 stars review
11/16/2023,I dislike dishonesty!! Seller provided wrong and misinformation of product and shipping information. Not a satisfied customer and I would like my refund!,1 out of 5 stars review
10/29/2023,Unfortunately when the tv arrived the screen was broken-shattered actually. Obviously I returned it. As soon as my money is refunded I will order again.,1 out of 5 stars review
8/9/2023,Purchased the 50 inch Vizio TV had a good picture to begin with but just a year later a big green line across the bottom of the screen,1 out of 5 stars review
11/29/2022,"I brought it up extremely carefully, didn’t bump into anything, and I definitely didn’t drop it! This is ridiculous it looks like someone kicked it.",1 out of 5 stars review
7/9/2023,Had the TV for about a year now and the screen completely went out. It’s showing up static when no damage was done to it.,1 out of 5 stars review
8/30/2023,"I purchased my television on 08/26/23, a few days later the tv screen was full of black and gray vertical lineA. I strongly disapprove of this brand!",1 out of 5 stars review
1/18/2024,It was delivered on the wrong date when I was aat work and someone stole it. Walmart refuses to give me a refund or replacement.,1 out of 5 stars review
1/20/2024,The tv is burnt after 30 days of purchase the speaker stoped working after making a loud ringing noise it was annoying sound,1 out of 5 stars review
1/3/2024,broken it was a Christmas gift they just recived 2 days ago set it up and its broken have to take pictures tomorrow,1 out of 5 stars review
1/4/2024,it didn't deliver to me but the driver uploaded a pic from my apartment and said it was delivered. Full SCAM!,1 out of 5 stars review
12/30/2023,TV screen was busted when I got it. This is the second time this has happened and an exchange is not an option.,1 out of 5 stars review
1/9/2024,"I had a Vizio, but the picture wasn't as good on this one. The sound would not mute. Probably a lemon",1 out of 5 stars review
12/28/2023,Don't order online. This is the 2nd time I've tried to order a tv from Walmart for the delivery to 'go missing'.,1 out of 5 stars review
1/4/2024,Four days into having it out yo after getting it for my kid for Christmas the screen went black and won’t come on!,1 out of 5 stars review
12/30/2023,Returned Nov. 10 but not credited to my Discover account. The $49 protection plan I bought with it was returned. The TV was $398.,1 out of 5 stars review
12/30/2023,tv does not start. Box has been thrown outnd im recovering from heart surgery. please send replacement and take broken one.,1 out of 5 stars review
1/18/2024,"fedex driver left a 65"" television on my sidewalk. did not deliver to the door. i hate walmart !!!!!!",1 out of 5 stars review
12/26/2023,This order shows as delivered but was never received. I have tried to get a refund with no response.,1 out of 5 stars review
1/7/2024,The volume on the television kept going in and out and does not maintain constant volume. Worst tv I’ve ever bought,1 out of 5 stars review
6/12/2023,"very disappointed in Vizio , the sound quality is terrible, you have to tirn it all rhe way up to 80 to hear anything. The tv lags to catch up with the steaming. would not purchase againg.",1 out of 5 stars review
5/7/2023,Advertising 4k gaming but it can't 4k game. Contacted Vizio support and they told me it is a firmware issue with no estimated timeframe for the bug fix.,1 out of 5 stars review
3/6/2023,I bought this to 4 months ago now when I try to watch anything the whole screen just flickers. I can't return or exchange it because it's been more than 30 days. So now I guess I deal with it or cough up more money to get a new one,1 out of 5 stars review
8/1/2023,"the TV box contained no power cord, connecting cable,remote, instruction boxlet or accessories. just the TV nothing else making it impossible to program or use. was a resold return",1 out of 5 stars review
10/1/2023,I don't know yet because since I ordered it last night I thought for sure It would be here for the Football game! The game starts in 15 mins and they are still preparing it.,1 out of 5 stars review
9/14/2023,"Doesn't have two of the apps I watch. The whole reason I got this TV was for those apps and you can't even download it. My new firestick Doesn't work with it, and no sound when using the cable box.",1 out of 5 stars review
7/30/2023,Replaced my 6 year old Vizio TV 55 inch with a new 65 inch arrived by delivery set up within two weeks it was giving trouble coming on changing the channels but mostly controller would not bring TV set on going off mid programs $*!,1 out of 5 stars review
9/29/2023,i have reset this tv several times and called customer service and after 1.5 hours there is nothing that they can do.  its not connecting to servers they say. so unable to watch any paid apps,1 out of 5 stars review
8/19/2023,TV came with no remote or screws for the legs. Called multiple departments within Walmart to get a hold of someone and not one person answered. Returned! Will never buy online again.,1 out of 5 stars review
9/27/2023,I'm very unhappy with my order . I received my tv late now I have it . Sometimes it wont come on or connect to the internet. Or I'll have to wait a hour before it will power on,1 out of 5 stars review
9/23/2023,i got it out of box and set legs and remote but no cord to plug into the outlet to turn it on. i dont want refund or its too big to return and box is broken down. i just would like a cord to be sent to me today.,1 out of 5 stars review
8/6/2023,"Awful.     TV quit working two days after delivery.

Keep your box if you buy this one.    Hopefully you won't be packing it up and sending it back.  But I wouldn't count on it.",1 out of 5 stars review
7/19/2023,It stopped working after two weeks! Went to the store with the tv and no box because who keeps a box after two weeks. And Walmart didn’t wanted to replace it. They said they needed the original box.,1 out of 5 stars review
10/14/2023,Got it home to find a crack along the whole screen! No damage to box or packing!  Then had to haul it back to store and no replacements avail anywhere! Waste of time!,1 out of 5 stars review
9/14/2023,This television does not work outside the Continental US. The home screen is blank. The only resolution that the CSR can offer is to purchase a streaming device to use with it.,1 out of 5 stars review
7/25/2023,"I thought got the kind of tv that sits flat on a surface, this stands on the tooth picks and with cats, dogs and a clumsy roommate, it just won't work.",1 out of 5 stars review
7/25/2023,"tv looked great..unfortunatly, there was a tiny craxk in lower corner of frame causing a black squiggle on screen. Am giving them a second chance and ordering a replacement as the tv itself seems awesome.",1 out of 5 stars review
7/13/2023,could not even sign in.  killed 5 hours and never got a live person on the phone.   so close yet so far....your instructions instruct to hit the menu button.  not even one of those.,1 out of 5 stars review
10/5/2023,They canceled my order because of unusual use of my account. I ordered the tv because the box was too big to fit in my car. I guess Best Buy will get my business. No big deal!!!,1 out of 5 stars review
2/4/2024,i only received one TV your deliver person a lady delivered me one in the morning of that I received and then your delivery person delivered one and left it in the hallway downstairs in my apartment building and it was stolen,1 out of 5 stars review
10/9/2023,I hate it! Navigation sucks. Very difficult to use. The vizio programming is terrible. I would have never bought it if I had known. Where is Vizio made?,1 out of 5 stars review
9/5/2023,"I received my tv in a box %26 instead of plastic that you peel off a New TV, I received a Tv with cardboard covering the front of the tv like glass. I truly believe they gave me a used Tv!!",1 out of 5 stars review
8/21/2023,"the bix came half ripped from the bottom and delivery guy only took the photo of the upper half. this is an electronic i expect a brand new box and a brand new tv from my purchase
 not happy at all",1 out of 5 stars review
8/11/2023,"Purchased tv it arrived yesterday . Was set up today and screen is black, has sound but no picture. Vizio offered to have a tech come out. I'm beyond upset. How does a brand new tv do this ?",1 out of 5 stars review
7/12/2023,"worst TV i ever bought, due to valum is really low, in order to hear it i have ti raise it to 57. my sound bar is a very loud and it doesn't work ONN with this tv, really low.",1 out of 5 stars review
10/20/2023,I just like that a week later they Walmart where I got my Vizio from had a 5-in larger TV come out for the same price that has an internet browser that's bullcrap I bought my foreign internet browser mainly like I need the internet browser,1 out of 5 stars review
10/22/2023,The box the item came in had holes on top of it having holes when I set the item up it would not connect to any of the applications and the volume kept going in and out.,1 out of 5 stars review
9/3/2023,"I cannot hook it up to my air antenna, hit has no information to do so, I tried to call them, there is no user's manual for this model so I will have to return it",1 out of 5 stars review
9/28/2023,I received my tv with no power cord or remote..called had to order and pay for the missing items a week later approx the coed arrived and then the remote..tv won't connect to the internet..still trblshooting it,1 out of 5 stars review
8/23/2023,"I'm very dissatisfied with this TV. It has stopped working twice in last couple weeks in middle of a show but eventually came back on.  Stopped working again on August 22, and still not working. Waiting for help to come to take back to store.",1 out of 5 stars review
7/30/2023,Tv came in broken. I sent it back for a replacement  but the return process has been a pain. The new tv comes in in 2 days. I will update the review then.,1 out of 5 stars review
8/16/2023,"did not load settings menu and input menu right out of box, still waiting on verizio call back or walmart to call back.  customer service or electronics no answer fayetteville ga",1 out of 5 stars review
10/7/2023,This tv has a terrible display. Have tried every setting. Everything is slightly fuzzy. Used hello tech to install. They took the box. Idk how to return. It's just awful.,1 out of 5 stars review
7/18/2023,television is okay The sound is not very good I bought  insurance for 2 years I think it was 35 more dollars and haven't get any paperwork I haven't seen anything about it but they took the money!,1 out of 5 stars review
8/4/2023,Would not recommend this as it would not receive local channels. Had a company repairman come out and worked on it and the tv still wasn't working. Return it and replaced with a different brand.,1 out of 5 stars review
8/9/2023,"The tv has poor sound quality and the eARC port also doesn’t work properly. TV often loses sound with my Google Chrome-cast. I tried to return but missed the return deadline by couple of days. So, now I’m stuck with the tv without sound.",1 out of 5 stars review
7/18/2023,"My pkg was left on my neighbors porch without even a knock to alert them. This was an expensive TV, no signature and no contact to be told they had the wrong house. Just horrible!",1 out of 5 stars review
9/10/2023,"I understand items can get damaged in the shipping process, but the time spent waiting on the item over the weekend was a waste.  The back of the tv was cracked which doesn't make me feel comfortable mounting it on my wall.",1 out of 5 stars review
7/13/2021,"This is garbage. Do not buy! Less than two weeks after purchasing this crap, there's a vertical big thick white line showing on the screen. Poor picture quality. It's horrible! I purchased this TV for my mom and I'm so disappointed.",1 out of 5 stars review
9/12/2023,We purchased a 55 inch vizio tv.  There were no instructions in the box on what needed to be done when setting it up.  No instructions on use of the tv or remote.  Very disappointed.  Should have purchased a different brand.,1 out of 5 stars review
8/19/2023,"The tv volume would not work on cable called my technician out %26 it was the tv 😩, now since I got it online and picked up in store I have to wait til my money is refunded to purchase another tv , I don't understand why I couldn't exchange it",1 out of 5 stars review
10/21/2023,"Do they buy!!! Must be cheaply made, we purchased this and only hd it a week before a red pixelated line showed up on the right side of the screen going all the way ip to the top",1 out of 5 stars review
5/12/2023,"Walmart trashed my original review while I was writing it, so I'll make it brief.
Around  April 20, 2023 Vizio did a software update that made it almost impossible to watch my over-the-air channels with my slow and unreliable internet connection. I had to turn the wi-fi off to get them back. Even so, it's very slow to get a picture when I turn on the TV, and there's an annoying menu now too. I wish I had a not-smart TV again so I can watch the channels from my antenna again without a hassle.",1 out of 5 stars review
6/13/2023,I have one word for this tv and it is awful..... there is a brown tint on the tv and the colors are all washed out. I have a 5 year old RCA 4k tv that has a small dot on it and still has an amazing picture returned this tv and gonna shop for a new one!,1 out of 5 stars review
12/12/2023,Shoppers should know that Walmart is not reliable in delivering products they sent my item to the wrong location and refused to deliver it to the correct location and I was stuck with it they wanted to return it so walmart and refund me the money but I needed the item now not at a latter date I am going to think twice before I order from Walmart again,1 out of 5 stars review
4/27/2023,"Total garbage from day 1.  Despite connecting to Wi-Fi the smart cast never loads and cannot use any apps after completing the required updates.  After hours and multiple calls to troubleshoot the TV, router, and ISP, the TV was replaced via the warranty process.  The new TV that was delivered had the exact same problem. Clearly, this is a manufacturer's issue.",1 out of 5 stars review
5/21/2023,"TV refused to connect to the app, didn't log into streaming services, was a nightmare - Spent 2 hours with Vizio customer service and then they disconnected me and sent me to a new rep. That was after telling my me to change settings on my phone and download other apps. ridiculous. Not very smart, imo. I'd rather have a tube tv in black %26 white. Exchanged it for a hisense Roku tv and set up took maybe 2 minutes, everything logged in immediately, app works, and I can stream from phone and other devices. This Vizio tv wouldn't do ANY of that! useless.",1 out of 5 stars review
6/15/2023,"I got this 65""vizio v -series  tv got it all set up and plugged it in to my cable I had no sound, the sound works on streaming  channels and antenna but no sound on cable now I have a vizio tech coming out to take a look just sends out a red flag when you have to repair this tv when you haven't  even got to use it cuz there is no sound on your cable",1 out of 5 stars review
4/25/2023,"Receiving this tv has been a complete headache. It was never delivered to my home I had to pick it up myself, which was an inconvenience. Before mounting the tv we turned it on it worked fine. Got it mounted put the LED lights on the back etc finally came down to watch some tv and the screen is black and I did a factory reset still nothing! Worst experience l",1 out of 5 stars review
5/18/2023,I've had my tv for four months and with no warning the tv blinked out and turned back in again only to stay on the black screen that says VIZIO. It won't switch to the app screen and it won't turn off unless I completely unplug it. I tried all the suggested troubleshooting and nothing worked. Total garbage. I had to give it one star to submit this review. It deserves a zero star rating.,1 out of 5 stars review
5/24/2023,"Bought this TV for my daughter's new place in March of '23. May of '23 it stopped working. I get it...it was a cheap TV ($350.00 /-) but almost $400 after taxes for two months of use?!

Stay away from this TV.

PS...there is only a 30 day return policy",1 out of 5 stars review
6/20/2023,"Bought this TV 3 or 4 mths ago, have had nothing but trouble since.  The TV continues to lose the cable channels.  I have taken it back to factory settings several times but it doesn’t help, I believe this TV is a lemon.  I wrote to Vizio and a representative called me and said they don’t give replacements or money back.  I only gave it one star because this app requires something.  It’s actually zero stars to me.",1 out of 5 stars review
5/17/2023,"I don`t think Walmart would like to know how I feel about this tv.I have had it for a week and still can`t watch it and don`t know when they will send someone to repair it. Their online help and live person help has also screwed up three other tv` receptions ,my personal computor and two phones.I am not a happy camper!!!!!",1 out of 5 stars review
6/14/2023,"Just bought 2 of these for kids rooms, specifically so they can watch Netflix however Netflix doesn't work with this tv anymore despite coming preprogrammed on the tv/remote. Vizio said a tech has to come into our home to install a piece in the TVs to make Netflix work. Needless to say, they're just being returned! All apps worked but the main app that we would be using was Netflix, if we had known this we wouldn't have purchased!",1 out of 5 stars review
6/8/2023,"Beware - this TV has so many apps uploaded to it (that you cannot delete or change) that it runs VERY slow - even after taking it off ECO mode. We searched/tried both VIZIO's site and the internet for instructions on how to make this TV work. We couldn't get any content to play from normal apps like Prime, Hulu or Apple after we signed in to those accounts on the TV.  We couldn't even get past the Netflix screen to sign in to it. We also could not get the chromecast that is supposedly already on the TV to work. It's too bad because we liked the size and the picture quality of the TV, however it's operating system clearly limits its performance. It took HOURS to setup. We had to reset it multiple times and it still did not work. We even let ...",1 out of 5 stars review
4/27/2023,"Ordered a new TV, sold and shipped by Walmart!  Received TV, it is refurbished, not shipped and sold by Walmart and Walmart refuses to help.  I have spent over 5 hours trying to return and receive what I purchased.  Beware when you purchase something on line.  Walmart confirmed it is mismarked but nothing they can do about it, just have to wait for a return label from the person that sent it",1 out of 5 stars review
5/5/2023,"This is not a technical review of this television, more of a complaint. I'm hoping it will eventually turn out to be a good TV. But there is a major caveat that any potential buyer should be aware of.

The VOC odor of this TV is the strongest of any piece of electronics I've even encountered. As soon as I unpacked it, every one of my family members commented on the awful smell. Within a few minutes, two family members complained of headaches.

I moved it out to my garage. I kept the garage door open during the day to help with the ventilation. The last two days, I've brought it out to my patio in hopes that the sun plus the outdoor breeze would help accelerate the off-gassing. It has not helped. The several times I brought it back in to see...",1 out of 5 stars review
3/26/2023,"This is a great value and has wonderful picture, but do not purchase this TV if you want to use any features such as screen mirroring, built in Apple Airplay or in general want a TV with updated firmware.  Purchased and right out of the box the Apple Airplay %26 screen mirror wouldn't work.  Spent about an hour trouble shooting on our own and over 1 1/2 hours on phone with Vizio support.  The firmware was not updated, so all the features do not work, and the TV would not manually update the firmware by factory reset, manual update or via a process that was a pain using a thumb drive.  Essentially this meant these features are not available and TV would always be out of date.  Vizio advised me that they would not send a replacement since som...",1 out of 5 stars review
6/21/2023,"Not the happiest with this purchase. The feet were incredibly difficult to install due to the holes being misaligned. Sound just SUCKS!! Had to purchase a sound bar for added volume. Picture is great. I don’t like it, but it’s fine for a secondary TV. My main TV is a Samsung. Fist time buying Visio. Won’t purchase another. Delivery was good.",1 out of 5 stars review
5/7/2023,"I used to have an old tv that would always lag and i just wrote it off as old, unpacked this tv and to my surprise it had the same home screen so being hesitant I started scrolling through to apps to find it had the same lag not as bad but still there. Picked this one out because vizio had better reviews along with it was more expensive so gave it a try. Regret my decision and wish i stuck with the other cheaper TCL roku models or something else. Its missing crunchy roll as well which is weird it has funimation that was bought out by crunchy roll. Also doesnt have forward rewind button on remote and back button doesnt work on Netflix had this tv two days and is 10x worse than its cheaper competitors. Save your money look for a roku alot mor...",1 out of 5 stars review
5/11/2023,Going to see how good or poor the Vizio customer service is.  The return window is 30 days.  I have had the TV 34 days.  All of a sudden I now have a vertical and horizontal line running across the screen.  No storms.  No power surges.  And even if that was the case I have it on a very good surge protector.  I'm so disappointed.  But we shall see what the process is with service or replacement.,1 out of 5 stars review
2/28/2023,"Had extenuating life circumstances to happen since the purchase of TV and it being delivered. Getting around to opening the TV and it is damaged. Had a technician from VIZIO to come to look at it because it was straight out of the box and they are unable to replace due to warranty. However, the technician noted that he could tell the damage was done when the store delivered it. Now, I am having a hard time obtaining a replacement TV from Walmart. I called Walmart and haven't heard back from a representative yet. and I am disappointed.",1 out of 5 stars review
1/25/2024,I am going to return GG the sound is horrible. You have to put it up up to 100 to get anything.,1 out of 5 stars review
1/27/2024,Havent had this TV 3 months and it dont work,1 out of 5 stars review
2/11/2024,I dislike that my soundbar turns up my tv at the same time.,1 out of 5 stars review
2/12/2024,TV dead in less than 1 month.   You don't receive compensation for all the installation work.,1 out of 5 stars review
2/20/2024,Didn't like that Vizio isn't compatible with my cable service. Needed to get cable from Vizio,1 out of 5 stars review
11/27/2023,the worst picture and colors  i have ever seen. DO NOT BUY ONE,1 out of 5 stars review
12/12/2023,my second tv lasted only 2wks after year  warranty.,1 out of 5 stars review
